lang,id,time,subs
es,H3EgK-y-hNQ,56,y la vuelta la tengo eso sí que es clave por 13 euros o sea me ha salido un viaje baratísimo el apartamento creo que nos
es,at0fEM4DTKY,84,1440 por 30216 así como hdr10 un muy buen brillo procesador snapdragon 8 de primera generación es cierto que después
es,q23p_tEGeS4,21,una decena de viviendas llevamos ya más de 140 hectáreas estamos hablando de unas 11 viviendas quemadas unos 500 
es,3GiHiCFCMLc,41,por hora normalmente son 25 en este caso son 20 pero luego diré el motivo por el que tiene esa velocidad o la que yo creo
es,8S-mNM2pi0E,216,decir 206 puntos más y la multicore 3 .822 por tanto 1034 puntos más así que podríamos decir que son buenas noticias
es,gFxGg9_RnlY,157,dormir una hora al día lo haría Me encantaría y de hecho yo duermo 6 horas de cosas que podrías llegar a hacer
es,HhKH_M3gg14,76,pulidora limpia faros es de la marca ryobi y cuesta unos 80 euros 87 dólares o unos 1500 pesos y la verdad que me lo
es,TsC2OrqnNjk,116,esto no era el final una Nueva Ola migratoria llegó en los años 70 después de que el gobierno francés optará por
es,i1PBMRRKwv0,65,en aliexpress nos van a devolver además un 14 un 15 pues dependiendo de cómo esté el porcentaje de casback en ese
es,BS-ilDVXo7M,139,al final me he venido a cenar un ramen me vale como 5 euros Será muy barato 800 yenes así que olé olé
es,QBaGW5gL4jg,41,habrán visto bueno pues vamos a verlo en la prueba como digo Son 408 metros es un vehículo tipo sub como podéis ver y
es,GvUUSQehIg0,124,muy potente pero a la vez que no se me dispare a los 10 .000 euros de precio aquí a lo Bestia y sin embargo que
es,X67kr4vy9M8,119,no la han dejado luego han para a la vez ha habido mala parada 4 .5 segundos cada 1 un desastre con las ruedas
es,1MIFWfza1ZU,45,Turbo fase 220 caballos en aquella época estaba el r25 cuando yo era niño el r21 turbo el r18 turbo el r11 turbo en fin
es,7qkQfHixSvM,141,después de ser 1 de los finalistas el premio Julius servín el 6 de abril anunciaría su presencia en el Draft de
es,aX9ArhGG8Ec,767,"la más grande Caribe Caribe con k no 
sé vamos a preguntar vamos a preguntar 10 euros para subir a la torre 
Caribe con k o no caribeño ortodoxa No puede ser por las cúpulas"
es,fwoW_SdDPVs,70,os voy a contar un poco Cómo cómo está la situación a 17 de julio no bueno como siempre os agradeceré vuestras
es,_DPckHY4L8I,206,roja todo el rato y la gracia es que el de 140 caballos es más potente y da muchísimo más parc salvo en el final así
es,puKrKp9UWbQ,51,completamente de mí mismo en el camino y a los 42 años mi marido lorenzo me engañó cobarde
es,vSxwnbeALM8,135,rallys esos rebotes duraron de media muy poquito 30 días 70 días pero no ha habido ninguno en los últimos 100 años
es,3Ve1AY5Ztss,12,con la estudio display hablaremos del futuro del Apple watch de los iPhone 15 Pro gracias a las filtraciones de esta
es,v8s5i60Zk1Q,44,semanas o de los últimos meses no en apenas 24 horas y a cada cual de estas mentiras más gorda y más bochornosa
es,yTCkTkzxTeA,173,Hay que decir que si puedes elegir ruedas de 10 pulgadas antes de ruedas de 85 siempre las de 10 van a ser más
es,aqGwTVrKqI0,22,mención a otros pero me voy a centrar también en mi experiencia con iOS 17 instalado en mi iPhone 11 voy a hablaros
es,ioMGz26BZeQ,35,nosotros mensajes personalizados Así que ahora más que nunca este oppo find n2 flip tiene más sentido como un plegable
es,XerUPdM-fRo,181,mexicana por su parte Brasil se separó de Portugal en el año 1822 con una extensión pacífica y bajo el liderazgo
es,L-L6I-zjiQE,358,"popular no tiene mayoría absoluta pero en este 
escenario de la razón de NC report lo que nos   estaría marcando es hasta qué punto una parte del 
psoe no le dice toma los 27 Toma lo que necesites   pero gobiernas Inbox Este es el escenario más 
claro de que eso pueda suceder fíjense que hemos  "
es,fo3TgK6bcvQ,178,podéis pedir vuestro dispositivo con envíos gratis hasta el 22 de mayo Eso sí es importante que os aseguréis de que os
es,CG9GIvO4jPM,134, 14 .470 millones de dólares lo que se traduce en 4 con 75 Dólares por acción fíjense que esto se compara con
es,yojzU7nhZAs,69,único de 200 alumnos que suspendió la selectividad para 8 años más tarde negociar 360 millones de euros en bolsa
es,vTduESoWe7k,6,Costa que sois muchos los que a día de hoy seguís utilizando el iPhone 11 o conocéis a alguien que pueda tener 1
es,REVwuOr3eL8,12,Nosotros hemos instalado ya la primera beta en un Apple watch series 8 que tenía por aquí así que bueno os voy a
es,I01r7cH4Ydc,176,puedes y eso hasta ahora era impensable O sea que voy a tener un coche de 400 caballos si va a consumir 15 o 20 litros
es,i3t4b0yP2ZE,118,volverá a cerrar para aquellos que estéis interesados están renta 4 me preguntáis de mainbestor depende más un
es,TrIK93DP51I,70,crecimiento en lo que va de año china ha crecido un 55 % Gracias en gran parte a lo que daba de Sí ese primer trimestre
es,joNBIdvgKYQ,91,una botella de champán de oro te vale 5 .000 dólares la botella esta de champán bueno valdrá 5 .000 $ en la discoteca
es,sdDZUl9BlPg,25,un sistema diferente Entonces tenemos el 433 ya completamente tocado y herido de muerte obviamente no lo sé no sé si
es,AftKoCG29CU,352,"Sí nos unimos a Algair para
conocer esta estadística. Nos unimos a Algair en los
años 20 o 20 de 2011 . Con unos ingresos de 20 millones."
es,RTIkeAph-30,28,mostrar esta hoja que es la de los iPad compatibles con iPad o es 17 de forma resumida os cuento que van a ser
es,K398OYnrIPA,3,la esquina lo que podría suponer una inyección de liquidez de más de 27 billones de dólares y es que a pesar de
es,0XhF6IXrTkY,12,desinformen veamoslo sumar es la versión 2 .0 cookies sonriente Aparentemente inofensiva de
es,svQmZg0a60U,247,ese ya pesa un poco no venga a nivel 6 del López [Música]
es,w1UDygjc_GI,12, 100 % en chino con su batería Blade de última generación 85 kilovatios hora y nada menos que 517 caballos sí es un
es,fo3TgK6bcvQ,165,comprar un layer esta semana antes del 15 de mayo Vais a tener con el link que os dejo en la descripción una promoción
es,He-Kecg_eu8,206,Club comprador y jugador aquí se tiene que poner de acuerdo primero 2 el jugador y el club que vende Y a partir
es,PQNyDKSQ6GY,87,cómodo en la mano puedes hacer un poco más grande pues a pesar 200 gramos es bastante cómodo pero sí que creo que la
es,UrIAA-ebM38,15,versión Release candidate bueno la de iOS 16 .5 pero también la del resto de sistemas operativos hay Azules
es,dLp7HNyHojk,33,la versión de 90 caballos y además mantienen una glp con 100 caballos bifuel que según Renault es capaz de
es,3840s49EuS0,71,rusas irregulares para detener su avance derribando 6 helicópteros y un avión ruso Sin embargo a pesar de su rápido
es,bbRWImWrK8k,153,que eres un guarro o el volante que has comprado el coche tendrá 20 años y no se ha limpiado jamás entonces puedes tener
es,A25QH-possU,145,esto hasta que llegó podríamos decir la dictadura de la aceleración pura de 0 a 100 kilómetros por hora y en eso es en
es,ekatt0vM_A8,111,velocidad 3 modos 6 por hora el modo más lento 15 por hora el modo medio Y luego el modo más rápido son esos 20 
es,ArBnj7rKjX8,79,son 4 vídeos y de hecho el último vídeo era el día 4 y día 5 también entonces igual lo hago en día 4 y 5 
es,Lxw3MvBC1hw,57,está Genial porque tenemos una Carga rápida 20 vatios y luego de autonomía 4 .870 vatios lo sometimos a un test de
es,q23p_tEGeS4,80,tenerife de la Cruz Roja y la policía también se ha activado a 150 efectivos de la unidad militar de emergencias para
es,I6ftuwtSNsc,3,la fecha xiaomi 13 Ultra contra el Galaxy s23 Ultra el mejor Galaxy el mejor Samsung hasta la fecha y que
es,o71_7IhGcQA,11,el doble que las generales de noviembre de 2019 los carteros ya han entregado la documentación a casi un millón 900 . 000 
es,HREPJnV-iP4,22,en los mercados que son alcistas aún así 4500 por encima el cierre semanal no es menor haber conseguido eso por parte del
es,L-L6I-zjiQE,285,"la importancia de vox empieza a limitarse mucho 
empieza a limitarse muchísimo Son 180 diputados   superan con mucha fuerza la mayoría absoluta 
que estarían 176 pero vox pierde un poder de   negociación muy importante aquí la caída de 
vox para gástres Narciso michabila es enorme  "
es,AVRs-kHFFXk,734,"a ver a ver gracias a ver hombre lo tuyo son las gorras negras 100 
pesitos mexicanos perfecto ahora llevamos puesta   vamos a invertir una gorra de México hay muchos 
modelos Pero me gusta siempre el color negro"
es,hVsDisFmTD8,26,Florentino Pérez por ejemplo es un 30 % más rico endesa es un 70 % más rica pero las familias repito son un 8 % más pobres
es,4dtnbolS2Jw,8,por Ucrania habría acabado con el exocop estaba en verdians en el hotel dun a 100 kilómetros del frente con él una decena
es,I6ftuwtSNsc,107,es que no vamos a ver ninguna diferencia tenemos 67 pulgadas Prácticamente la misma la misma dimensión tecnología oled
es,hpY5TVwsjDY,12,que está observando ahora mismo en el mercado para este año 2023 aparte de otros consejos que ha dado a los
es,IB7ADRoEqCU,32,bueno bueno bueno bueno bueno bueno bueno hoy GTA 5 va a ser invadido por esquibitoides hemos venido aquí con Tito
es,aqGwTVrKqI0,24,también en mi experiencia con iOS 17 instalado en mi iPhone 11 voy a hablaros de 2 apartados principalmente las
es,CRkEITbGk5c,198,punto de vista del lanzamiento del series 8 deben tener en cuenta que es un a ver el año pasado definitivamente se
es,9dn1ALQw7TY,36,coches por un precio que va de entre los 100 a los 200 .000 euros unos beneficios gigantescos para un aficionado que no
es,RLGYUjBUB30,14,tenía pensado comentarlas Pues en el vídeo de la Beta 4 pero ayer Apple por sorpresa lanzó una nueva actualización
es,5zh-JBSeHmE,31,híbridas enchufable acá en Europa solo se va a vender en este formato 4 por e que es el emblema la enseña de Jeep en
es,A40ysiB22FQ,198,"da para vivir en Estados Unidos.
En Estados Unidos mi hermano es mentira. Tengo 30 años
en este país mucha gente viene con ese deseo de que Estados
Unidos es oportunidad es de"
es,4W3UWjyyVkQ,135,lenguaje javascript javascript es un lenguaje que tiene 30 años y typescript es un lenguaje que se creó en 2012 
es,XMVwk9qElUI,199,jugadores de la temporada para el premio John promedio en 36 partidos 20 puntos 52 rebotes asistencias por encuentro
es,_gHMJDrFwqg,154,parece importante comentar es que el poco f5 viene también con una fundita en la caja algo que no tenemos en el Galaxy
es,WXD9nzGNm2c,30,ica 11 hemos venido de viaje a un pueblo pues como de 11 ms y ahora mismo vamos a comer a un italiano en
es,JaJEK7R8pS4,221,"altas estrechas de 3 plantas con Los 
Balcones de madera y forjados en hierro   algunas en ruina como esta la comarca Tiene 
un total de 18 poblaciones en un territorio   que es bastante extenso por aquí han 
pasado civilizaciones como los íberos  "
es,ekatt0vM_A8,63,circular a 25 kilómetros por hora pero tú irás a 20 y si te va a generar frustración y vas a ir todo el día
es,pKzKMlgKP-0,95,este caso 108 MP con visión nocturna de 20 megapíxeles lo cual es interesante también para lo que hacía antes Salimos
es,DW9t8i0il3Q,24,un segmento de Mercado muy chico el que puedan permitirse 3 .500 dólares y además falta un montón
es,q1j7KygaRBo,167,albergadas en la mente subconsciente que constituye entre el 95 y 98 por ciento de tus pensamientos en tu día a día
es,GTHoZyp9Kuw,16,vídeo sobre todo esa velocidad es el ahogo uptec v8 comenzamos [Música]
es,B3QiyQcM3BM,24,Pues sí compañeros aquí la tenemos la famosa arena vt3 una de las mejores motos eléctricas calidad-precio Que
es,A25QH-possU,147,dictadura de la aceleración pura de 0 a 100 kilómetros por hora y en eso es en lo que estamos actualmente y en eso que
es,3OAQffhQxxE,169,dinero que tendremos después de 7 años Tendremos que multiplicar los 20 mil dólares por 1 más 5 entre 100 
es,0px_wuKOwsU,164,euros en total sumemos esos 70 kilos de la prima de fidelidad ya son 140 a los cuales hay que sumar los 80 de la
es,GEPeqwQLKIk,68,Francisco te hemos preparado un Toyota Corolla de 200 caballos ahí lo tienes preparado para hacer la prueba y claro
es,dLDtAAweJL0,199,"muy cerca de Oaxaca solo 20 minutos y pueden
tomar como hicimos nosotros un taxi colectivo que sale solo 20 pesos por persona un euro
por persona está perfecto vamos a probar algo de la gastronomía de aquí algo para
desayunar y después continuaremos ruta hacia"
es,3j3SVk5t364,52,adelantado y ahora vamos por el capítulo 780 así O sea será tragado y le flipa el tema los valores el tema de la amistad
es,nSG4kLycD4Y,192,otros bancos ofrecían un 2 % de interés el banco saroshi ofrecía un 6 % os preguntaréis Cómo era esto posible según
es,HuFoYWuMrLU,92,frutos de su duro trabajo más unos 50 .000 que le prestó su suegro se decidió a emprender en 1960 fundó
es,kuGoK2utlC8,114,Bueno ya sabéis os arrepentís si queréis regresar a iOS 16 al final de este vídeo precisamente os voy a dejar una
es,TW9vPbKVcNo,128,catalán y hace que a las 14 años desde hace de esa serie madre mía en el 2009 era por ahí y él fue 1 de los
es,3serNOGodLI,83,la arena vt3 5 .600 vatios de potencia motor trasero evidentemente
es,dr5x8yFQIa4,60,este dispositivo 12 s Así que analicemos 230 para este equipo recién salido al mercado Y si nos vamos a la versión de
es,MKidF2B8NFQ,142,al primer trimestre del año 2022 con un 38 % más del triple que la media Europea el 1 % es la media europea según
es,8nUniM0JZsc,132,posibles en iOS 16 tenemos 4 opciones y en iOS 17 tenemos hasta 7 vistas diferentes el widget de
es,PxQqVG-7eM4,128,el plan de Apple no era Mostrar esto en la Beta 1 simplemente se les escapó se les pasaría borrarlo de desde esta
es,lPNNwD4ehac,144,parecer las nuevas gafas meta Quest pro de 1500 dólares podrían utilizar varias cámaras externas para detectar la
es,gql7ZkHHej4,156,empresa que más holdea que es Galaxy digital holdings con más de 40 .000 bitcoins en su posesión pues esto no ha
es,Sg7Cq5nhYeI,30,con el móvil Y es que con una impresora 3D puedes hacer desde una mesa hasta una moto
es,9NqGLbkvhVU,201,2030 globalista 2030 es el punto de llegada donde la superinteligencia sí tendrá una
es,5GVGomIdl7g,142,que se utiliza para referirse a gente muy crédula en 1908 fue arrestado y cuando lo llevaron al juzgado con
es,XFNbBUKZ6Rc,70,mejores temporadas ruki jamás vistas en la historia 316 puntos 19 rebotes 27 asistencias por encuentro el mejor
es,AQJX0AmiNj4,37,Estados Unidos y efectivamente en el año 2022 hemos tenido la crisis de inflación y de escasez Incluyendo los alimentos
es,ApJTxjd8I0o,18,este fue un móvil de leyenda por supuesto por su cámara de 8 megapíxeles que incluía ya un flash led así como
es,yTCkTkzxTeA,72,una capacidad de 78 amperios hora en la caja viene el cargador de 2 amperios que nos ofrece una carga de 0 a 100 en unas
es,CG9GIvO4jPM,144,de 2 con 76 pasa de 2 con 76 a 4 con 75 es un cambio bastante drástico y superaba el estimado los analistas que
es,q1j7KygaRBo,111,nada justo el tomo del dinero tenía que ser el tomo 8 el número del dinero no me lo creo yo soy libra entonces la
es,X7tUurgvsbc,55,una oferta de estas de Que bueno que está ahí siempre son 200 euros económico y por 1 .149 euros lo tienes con un tera
es,i3t4b0yP2ZE,111,ahí ya 65 más o menos lo tienes que consulté y cuando vuelva a 80 millones o sea en cuanto entren 15 millones pues Se
es,RFAp41OhUX0,131,vox en vigor pagaría únicamente 1 .200 euros un trabajador que ingrese 50 .000 euros manuales actualmente en la
es,svQmZg0a60U,228,reto nivel 3 completado
es,Ik1uTdDG71g,277,este derroche en la factura de la luz hasta prácticamente 2015 fuente Miami me lo confirmó tanto eh
es,TMU9_-I5gw4,159,Congreso de hecho hasta el momento ya hay aproximadamente 20 republicanos del Congreso que han rechazado completamente
es,K6ULQWr3tHk,107,nos pongamos así en situación y claro si hablamos de 200 euros hay rivales muy buenos en el mercado desde los redmi 12 
es,UbCS_67gPnM,71,desayunado hoy tenía mucha hambre tuve clases a las 9 de la mañana pero era online tengo clase hasta los sábados
es,J8wQOCvCwRs,128,cómodamente en exterior hay teléfonos por 300400 euros que el brillo de la pantalla es más elevado y que cuando
es,7I1fAJDhSC0,103,como lo que ocurrió a continuación bienvenidos al Draft de 2003 1 de los mejores de todos los tiempos se
es,b-z-Sj3wmJA,207,una acción equivale el 60 % del valor a los 10 primeros años del Cash Flow de esa inversión por eso aquellas
es,bpxPcdsH8gM,42,euros la cuestión es que tiene 10 amperios hora 500 vatios de potencia y en ficha nos da una autonomía de unos 50 
es,X7tUurgvsbc,160,puerto HDMI 2 puertos usb-c 13 .1 y el otro sería 4 .0 tenemos USB tipo a Y tenemos el Jack para los
es,neWy_CrIELU,60,importancia porque las hacen en los mismos que también un 13 de julio justificaron el asesinato de Miguel
es,at0fEM4DTKY,13,la semana mega bestia Esta que está preparando aliexpress que del 12 al 18 de junio pues va a tener ofertas muy muy
es,AGZzsW7noBo,50,grados y atentos a las velocidades modo 1 25 por hora modo 2 35 por hora y modo 3 50 por hora
es,3GiHiCFCMLc,83,hacer en condiciones normales pero esos 20 kilómetros los puede hacer con una batería que está alojada en la base de 5 
es,2ZcCNKK6s8M,773,para ir tranquilo y tal 2 jornadas si te pago por ejemplo 3000 euros tú serías feliz
es,X91FnpeyMqg,140,bien Empezando por el principio si no conoces el funcionamiento de una lager 2 o capa 2 básicamente se trata de una
es,Nx5Ge4PcOyA,5,London un joven de 23 años largos rizos metro 80 y elegante ropajes espera de pie en la Plaza de la capital inglesa
es,0z5YOe_5Z-M,90,pensaba que podía plantarle cara por ejemplo Al poco c5 veo que a lo mejor no están así entonces lo he pedido para
es,AVYyECn2FhU,72,por ciudad todo eso con consumos ridículos de unos 6 litros Así que aunque tenía otros coches mejores
es,FYmF71zPTkg,1,hecho desde que empezó La Guerra de Ucrania y ya por febrero de 2022 es por qué nadie mata Putin para que acabe así
es,5mFBsRcz5sw,119,todavía se comercializan como puede ser un oppo x6 Pro o algo así pero en este caso con los mejores que tenemos
es,136pe_WnKUw,18,pillando fuerza después de que muchos contratos acabasen el pasado 30 de junio y de hecho Hay ciertos movimientos
es,M4q7AEGF0yA,213,sabes en plan también qué utilidad le ves a las Vision Pro 11 te gustan mucho pero Si este tío se ha
es,NMAUmZTBMME,46,los nuevos puestos de trabajo se generan Estados Unidos fueron 209 mil que ya por primera vez era peor de lo esperado Vale
es,lXcGmG_GcZk,155,notar un punto por cada año de vida de su abuelo 61 puntos que parecería una locura sin embargo la fuerza del corazón
es,dD7ctbMmrOA,112,pero por eso este es el sitio de fuera y luego ya veréis en el blog de 2002 dentro buenos chavales ya estoy de
es,svQmZg0a60U,257,me refiero le toca el nivel 7 ahora nivel 7 
es,mZa0Wm7eQhg,216,teléfonos el iPhone y el Samsung Galaxy s7 como no tengo micrófonos habilitados en cada 1 de estos
es,JYmiaEHhxns,100,multa el tubo de escape es reglamentario 2 sí está todo bien Se ha terminado ya vale no va alineación de la Game lic el
es,u7rO-Z_SiUs,40,de gobierno que han alcanzado PP y vox en la generalitat valenciana 50 puntos de un acuerdo que fui analizando 1 por
es,UrIAA-ebM38,145, 16 .5 que ya la tengo instalada en mi iPhone 14 promax y precisamente para poder contaros también qué tal su
es,bqifX6TVR5U,66,algunas peculiaridades por ejemplo Tendremos una batería de hasta 18 horas y luego también pues tendremos el chip
es,thz8oL8gpCE,346,Sí en administración de empresas fue más o menos en el 2009 Y entonces ya después de ahí murieron mis abuelos porque yo me
es,GgFKRgyMpDs,23,Lorenzo vamos a un evento eso el 17 de septiembre de 1497 al mando de las tropas del mando de la armada del
es,GeQxaDaqi10,73,trasero de 750 vatios con picos de hasta 1000 vatios capaz de generar suficiente potencia como para cargar con un adulto
es,wVR_H5_SMgo,137,cada nuevo vídeo que no se te olvide Es verdad que en el Galaxy a54 ni el a34 Contamos con Samsung dex para convertir
es,9nMGUfnFgaQ,395,"esta pirámide la del sol tengo entendido
que es la tercer pirámide más alta del mundo mide 64 metros
esta la del Sol en realidad Son 6 pirámides en una construidas una sobre
la otra se nota bien las fases de cada"
es,rNJnLBkbLyw,42,políticas sociales luego un pequeño descanso de 4 minutos para que repasen apuntes y luego pues política
es,vOcdVzTS3Ng,77,ese discurso el mercado se desplomase pues un 4 % vale antes de comenzar recordaros que ya tenemos abiertas las
es,NRCYqTIIdmY,73,algunos destellos de Gloria mediados de los 80 unos playosos en 1994 donde parecía que se iba a cumplir el sueño
es,9J30uX2BC0k,141,"que se ha establecido en ese Rango superior que 
se ha atascado y que no ha sido capaz de superar   ese 16 .4 con algunos idas y venidas pero ahora 
mismo lo más probable es que permanezca cierto   tiempo en ese Rango parece que faltan argumentos 
para atacar esos máximos y continuar la tendencia  "
es,1eR1H_ema4M,190,coche Es que su potencia entre comillas de 156 caballos podría aparecer más bien justa o escasa para lo que se lleva hoy
es,_4QFgGIahNE,764,conformidad con los artículos 27 .2 del estatuto de autonomía de la comunidad valenciana 2 .2 de la ley
es,OGj1JcxEHLo,83,máximo alcanza el 54 % es decir que a partir de unos ingresos de 300 .000 euros Que obviamente
es,LDZGPstohWw,107,los consumos definitivos de este vehículo cupra anuncia hasta 550 km de autonomía que tendrán que confirmarse
es,IY8ZhOUE2TU,136,hijo desde que usted llegó al gobierno que el año 2019 hasta el primer trimestre del año 23 usted no consiguió
es,DNm4DgWw6Rc,146,el último gran intento finales de conferencia de 1995 pero le tocó bailar con un cohete indomable hakimon de nuevo
es,liL7DR25eVs,227,titular un escudero para cualquiera que lo necesite una campaña 2023 promediando 13 puntos y 34 asistencias por
es,6kdiHXGciBM,127,en 100 kilómetros solo a puñito y 150 km en asistido y con su cargador de 2 amperios cargaremos las baterías
es,FHKqM1h6qTc,8,se tiene una perspectiva de poner encima de la mesa unos 800 .000 millones de euros y lo que dice gentiloni es habría
es,dKN3DS0APRY,39,de terminar a finales del año 26 se dará otra entre el 26 -27 cuando la Unión Europea haga una revisión de Cuál es el
es,9nMGUfnFgaQ,122,"estación del Norte y en solo 45 minutos
están en las pirámides nos ha costado 208 pesos mexicanos que son unos 5
euros por persona ida y vuelta y algo que no sabíamos es que también está el
pueblito de Teotihuacán Yo pensé que"
es,0z5YOe_5Z-M,35,como yo me pensaba De hecho he perdido el poco f5 para hacer comparativa Pero es verdad que aquí con el Sony MX 766 
es,f8idx-Ltqbo,24,auténtica barbaridad madridistas que nos desvíen del foco principal 19 años y un talento descomunal ha renovado modric el
es,zDvNq-Uj5HY,0,si de verdad el Real Madrid no Viera opción si cabe un 0001 % en fichar aquí la mbappé y va a dejar el 9 libre
es,rTzMHV4SBw8,96,Al momento de realizar la compra os harán un 25 % de descuento si la hacéis antes del 27 de junio pasada esa fecha
es,0jQmDLCFkLg,23,ha movido comentarios sin duda es Quevedo con 520 .000 euros si esto es real que no no se sabe lo general a mí
es,gQVB4Nqzzu0,246,Nacho de 0 a 10 de 0 a 10 Nacho cuánto crees que es una pantomima y que
es,I6ftuwtSNsc,112,misma la misma dimensión tecnología oled 120 hercios 1440 por 3 .000888 3 .200 no hay mucha diferencia si aca como ya
es,Ik1uTdDG71g,159,de espalda si me queréis respirar me quedo [ __ ] con 10 años después 18 años vuelve a tocar
es,lXcGmG_GcZk,134,un total de 5 jóvenes de entre 14 y 15 años más de 2000 personas asistió a su funeral una persona realmente querida
es,fZ7hwN0EMdw,74,literalmente no ha dormido o sea salí a las 3 de la mañana de casa y ahora son las 12 estoy en españa se ha dormido
es,aqGwTVrKqI0,140,esta función está solo disponible en los iPhone 12 o posterioridades y además ojo solo en inglés el ajuste de
es,vidUDNmNukI,26,nivel publicitario que el Real Madrid en lugar de sacar 25 o 30 millones podría sacar incluso más y que lógicamente a
es,I6ZsvnRNBO8,125,un poquillo de tilín este patinete súper económico el ahogo obtek v8 te invito a que veas su review completo y veas de lo
es,I6ftuwtSNsc,14,salir Cuál es el mejor móvil prácticamente ya del año del 2023 Así que ahí es nada Vamos con todo empezando
es,KczhWiCUeIM,174,meses después el momento por fin habría llegado en aquel verano de 2003 y los Miami se hicieron con 1 de los
es,2JbekXAtveg,83,español al que le dijo déjame pasar con 100 .000 soldados por España que voy a invadir Portugal Solo que con Portugal
es,5via5xp9-Gw,18,nadie los puede discutir así 8 millones de euros a negreira casi 8 millones de euros a vicepresidente del comité
es,QDXLIHQH6ic,192,duda el punto número 1 y el punto número 2 se lo llevan completos hablando de ese rediseño general que es muy
es,gdLax9iDzEo,131,inflación y como les decimos en esta encuesta tenía un porcentaje del 44 % pero ojo porque tiene un 52 %
es,LFI1BqfOt0E,208,pasa es que claro para hacernos ricos aquí en GTA difícil pues bueno día 1 completado a ver no es lo que yo pensaba
es,5mFBsRcz5sw,82,y también que el xiaomi pero en este caso a la hora y 6 minutos ya tendríamos este p 60 pro con 88w de Carga rápida
es,R3S0piIucz0,152,pantallitas tecnología y todo eso hay coches de 40 .000 ahora mismo que lo superan pero por muchísimo pero aún así
es,dr5x8yFQIa4,77,algunas diferencias porque claro de 128 a 256 ahí también 10 € y también sería valorable y luego tendríamos el redmi
