lang,id,time,subs
es,8nUniM0JZsc,21,es poner un iPhone al lado de otro 1 con iOS 16 en el lado izquierdo y el iPhone con iOS 17 en el lado derecho y
es,Htp-LKRVKYM,359,2 1 voice
es,UMeGExMLSxw,245,contrario Rueda delantera aquí la tenemos 10 pulgadas de diámetro hinchable por lo tanto genial a mí los
es,dLp7HNyHojk,115,identificar todos los clios un Clio del que se han vendido 16 millones de unidades a lo de la historia de las
es,R9t-5PSvwQw,137,pasada de que él quiera votar ese año de contrato que todavía tiene hasta 2024 con el París Saint Germain a partir de
es,Zcx139Hd8hk,151,muy bien a pesar de tener Pues eso altavoces de 5 vatios que son muy potentes para lo que encontramos además
es,pwu2FK_2yQs,155,de las primeras empresas de inversión en ofrecer fondos de inversión y 10 centrados en el oro proporcionando a los
es,t07f89Pgkjs,20,menos cuánto miden 60 centímetros Oaxaca es riquísimo podremos yo puedo yo
es,fEkO1B_bt0M,472,camino si el dni 48 [Música]
es,YBi7tRc4RRA,157,a comenzar ese porque es muy rápido tomando que desde el Mac mini m2 Pro hasta los Max Studios pasando por la
es,r4V-I-DotUM,619,"[Música] hay muchos americanos viviendo en San Miguel
de Allende es más el 10 % de la población de San Miguel de Allende son americanos que
vienen con dinero invierten se quedan a vivir"
es,RFAp41OhUX0,196,pagaría un 9 % por los ingresos que obtuviese por encima de 70 .000 euros hoy en día un trabajador que cobre 100 . 000 
es,5712roAYDII,25,parte de las leyendas la franquicia ya que fue nombrado entre los 25 mejores jugadores de toda su historia al lado de
es,30a9e207Fp4,48,para usar esta aplicación se necesita un iPad pro con chip M1 o posterior o un iPad de acuerdo Ahora sí comenzamos
es,ISMKECeFxZo,51,15 se van a ver bastante similares a los iPhone 14 Pero bueno con algunos pequeños cambios por ejemplo los modelos
es,_gHMJDrFwqg,138,más cómodo que el poco f5 sobre todo por los cantos más curvados del Galaxy 34 frente a esas líneas más rectas del poco
es,AGiayASyp2Q,124,pero habráis 2012 o 2007 Pero si ya van aquí 15 años lo que sea para un lenguaje eso no es mucho tiempo y yo siempre lo
es,UsLffxV60p8,207,revoluciones está muerto a fondo de 2500 y esto es por varios motivos el
es,N8tgv2pe1yU,174,Huawei p60 Pro que digamos que optó por la versión anterior a este snapdragon 8 de segunda generación que a partir de
es,ef9hLo_ZErg,125,sistemas más potentes que el actual gpt 4 durante al menos 6 meses advirtiendo de que estos sistemas de ia
es,jtPKfrE0QtQ,49,eso el vídeo Hoy está patrocinado por wondershare filmora 12 es 1 de los mejores programas de edición para
es,5j-mw01Ctsc,12,todos los que seáis de Madrid deciros que este sábado día 27 estaré en la feria del libro en el retiro firmando
es,1XeQ8UnrVug,11,segundo y lo segundo ya tenemos el armado porque porque 200 millones de euros pide el París Saint Germain por
es,qCKY8vGHuzE,6,hablar de actualizaciones porque en unas horas Apple va a liberar iOS 16 .5 junto también con iPad 16 .5 makow es Ventura
es,ypTAdToyBUA,31,apartamentos porque son los 200 estamos 16 ayer estuvimos en siena blanco [Música]
es,ClS2pwggzaY,187,transparencia y cuando el día siguiente los conecte al smartphone tenía un 70 % la caja o sea sólo se había consumido un
es,ClS2pwggzaY,31,cierto os dejo por aquí arriba el vídeo de los del realme 11 Pro Plus Se confirmó el precio de 7999 euros un
es,gSu_jQOVKDk,100,amigos vale tengo que entregar esto a 400 metros de aquí y Me darán dinero como bueno como mi primer cuidado
es,HuFoYWuMrLU,85,Queens eso no era suficiente para berni con los trabajos llegó a ahorrar 5 .000 dólares y a los 22 años con esos ahorros
es,VTA4rtqvnBM,199,la puntuación Single Core fue muy similar apenas 6 puntos más 2554 puntos y la multicorre
es,l_tO-P39Q0s,178,confianza así que dime señor da santa Qué harías si te digo que tengo a 30 snipers apuntándote a la tanto a ti como
es,aq38RX9X310,208,supuestamente cuando esa persona tenía 17 el rotativo de Sant publicó el supuesto escándalo Hace unos días sin
es,Yg4pVeUF478,12,cómodo De hecho fui de los primeros que tuvo unos dispositivos no tuve el Note 2 el Note 4 pero aquí nos estamos yendo a
es,AGZzsW7noBo,11,nuevo patinete eléctrico está muy guapo eh se llama quoring G3 comenzamos vamos a los datos técnicos que es una de
es,rbgtpksll2A,87,sentido Vais a ver el caso reales no estamos ya más de 500 que quien lo diría ni se me está pasando Todo muy rápido y
es,5rRxpixQy1Q,14,"mostramos en el capítulo
anterior nos fuimos remolcados 260 kilómetros
desde cerca de Los Ángeles hasta Tijuana donde nos
esperaba Abraham un mecánico"
es,R77hSoAyXeY,49,honda crv y porque este modelo bueno porque pesa poco más de 1000 kilos como un mx-5 pero tiene tracción a las 4
es,lqXdYx67TVo,135,los puntos fuertes del dispositivo luego a nivel de diseño son 37 gramos es un dispositivo ligero que se lleva muy
es,w1UDygjc_GI,202,burguesado pero ya en las versiones de más de 500 caballos tiene la suspensión claramente más dura hablando de caballos
es,xuOcMXp6N5g,5,carreteras españolas a partir del año 2024 y qué ocurre cuando se destapa transparentemente esta mentira pues que
es,1aRzRKS_kkc,79,el Liverpool ha puesto 200 millones de euros por kilian mbappé la oferta del Liverpool que ha llegado
es,vOcdVzTS3Ng,18,donde va a seguir la política de la fed los próximos 12 meses de acuerdo entonces ha sido extremadamente negativo
es,X5sfrpWgB5U,26,incluimos dentro de la misma lista lo que sería el Huawei p60 Pro el honor Magic 5 pro y el vivo x90 Pro mucho pero
es,T1lDKbIQcLg,163,que Kate Gil está completamente loco cuando en julio de 2019 comenzó a publicar una serie de hilos en reddit
es,OThn41IGWp8,163,morirme hay muchas bolas de golf aquí creo que me puedo sacar como 30 40 dólares Eh vale bien bien bien bien bien
es,lNsEUiA2e0U,59,sitúa un intermedio por encima del conocido mg4 que actualmente es el vehículo eléctrico que más se vende en
es,JaJEK7R8pS4,79,"Robles capital de esta comarca y como capital 
de comarca se estarán preguntando tendrá muchos   habitantes poco más de 2000 pero eso es lo bueno 
que tiene visitar estos pueblos la poca presencia   de individuos vean Qué hermoso pueblo chicos con 
las casas de la Ribera decadentes con Los Balcones  "
es,BH3nR121MbQ,8,serio que quieres ir a 200 Pues a 200 que quieres ir a 300 pues bueno si tu coche lo aguanta Por qué no Yo pensaba
es,Zw5QL3-Zyio,70,bueno y una Potencia de ascenso brutal su voltaje son 468 voltios y está limitado a 25 kilómetros por hora
es,6PSIf7KZMaw,41,directo objetivo vida independiente el próximo jueves 23 de marzo a las 8 de la tarde hora de Madrid regístrate desde la
es,L-L6I-zjiQE,393,"es un tsunami electoral a favor del PP pero 
espectacular un tsunami espectacular que pasa   desde poco más de 80 diputados a 155 prácticamente 
lo dobla qué es lo que se ve en la última recta de   campaña o el psoe resucita y se mete en 115120 
o Sánchez va a tener una noche en la que ahí sí  "
es,6ehU6_VyWpA,117,sepultanas comandadas por el teniente orad emplearon un de artillería de 75 milímetros para bombardear el complejo
es,t51AlDV41YE,128,extra que te puedes a gastar en una réflex esos 400 o 500 euros mínimo de más que te quieras gastar en una cámara
es,n1jdlgUaCzo,221,"Rusia y Arabia saudíes y finalmente se integra 
aquí ya tendríamos cerca del 30 % del pib mundial   nominal y si lo cogemos en términos de paridad de 
poder adquisitivo Sería más del 50 %. no estamos   hablando de ninguna tontería en occidente tenemos 
un problema nos gusta mucho mirarnos en ombligo  "
es,K_VFRhRKpLA,188,significante firmar como coautora del estudio y así fue el capítulo 14 titulado lessons from de arab Spring
es,q9hFzMLqZQw,116,por favor el rpm de ese canal probablemente no sea 6 sino 1 que igualmente ese canal estará generando un
es,ML8BXCgSP14,10,interesante tenemos muy buen sonido con drivers de 11 + 6 milímetros sí tenemos 2 drivers tenemos un diseño muy
es,i1PBMRRKwv0,108,debería cargar Como 45 vatios y el poco a 67 y el redmi que debería cargar también es 67 sin embargo va descolgado
es,yaxPPoRdwmM,88,muchas oportunidades no es lo mismo que cuando estaba en el pico del 2021 que estaba todo más caro pues ahora Si antes
es,iV65SEb4aoU,195,ver el tweet o sea según pies y Community el 22 de junio ya estaba todo acordado el 22 de junio y nosotros
es,5zh-JBSeHmE,54,electrificado con un motor de combustión interna de 2 litros unido a 2 motores eléctricos una máquina hay un motor
es,yDg1SBm-PzU,145,comunidad valenciana y un mínimo de 12 .000 empleos por poner estas cifras en perspectiva la cantidad de dinero que el
es,koIsSH0X9Zw,5,pruebas para convertirse en un ninja profesional en GTA 5 pues chicos hoy os traigo un mod exclusivo donde vamos a
es,LNbUuQoo8M8,148,fabricación estadounidense dañados y abandonados así como algunos a MX 10 donados por Francia entre otros
es,vuKw5peVRag,20,próximo Dime algo que no pueda faltar en el próximo GTA 6 Para mí sería muy guapo que incluyeran un montón más de animales
es,F6cXloymOUE,116,son muy elevadas dado que agrupa al 43 % de la población mundial mientras g7 tan solo agrupa a un 10 % a la población
es,F58rzrdcZKU,84,el París Saint Germain tiene esa postura 100 % de decirle aquí lean mbappé como le dijo públicamente y también a nivel
es,jNsEEDNzRBI,148,milonga etcétera Basilio dice va a venir y vamos a ganar 10 Champions seguidas el jabato dice le llama la tortuga por lo
es,q23p_tEGeS4,23,de 140 hectáreas estamos hablando de unas 11 viviendas quemadas unos 500 desalojados se sigue los procesos de
es,wgDhhdppO6Y,13,hacer nada tenemos mucho tiempo porque son las 2 y a las 5 :30 cogemos el blablacar de vuelta a Madrid
es,2ZcCNKK6s8M,687,dicho Ponme la niña ha despertado a la niña de 7 años que me ha dicho papá qué pasa y le he dicho
es,KANcLpyMMlo,34,me gusta más el honor comentaré pero ya por ejemplo el precio de salida son 1200 euros en ambos teléfonos con la
es,AftKoCG29CU,239,"un problema en la cadena
de suministro e intentaban para resolver eso como un
joven de 25 años o lo que sea aproximadamente en ese rango
construí el primer software y fue"
es,UMeGExMLSxw,210,aleación de aluminio resistente y va a soportar una carga máxima de 120 kilos por lo tanto si estás por debajo de ese
es,G09JbruyGoI,88,Pro Max concretamente a la versión 2 .0400 esto quiere decir que con respecto a la Beta anterior Pues hay
es,kK_yAdkR3hM,20,casco de Apple os hablaremos del cambio que se avecina al Iphone 15 promax debido a una de sus nuevas
es,QYhl0c3SsRo,139,en este Rango de precio porque hay que recordar el Galaxy a34 que lo tengo por aquí precisamente con unos marcos
es,aJCF1yItlqc,70,de aquí a trancas de 1 de 2 que no le meten ni la pierna de 3 enfrenta a otro defensa
es,VTA4rtqvnBM,80,compilación el número de esta Beta es el 20 G 50 70a vale ojo a la letra letra a esto significa que será la última Beta
es,L-L6I-zjiQE,245,"gobernar del centro derecha en España Miren 
el siguiente gráfico electromanía nos refleja   haga 3 y ahora vemos también la encuesta 
de la razón grupo o acento ga-3 nos da la   fotografía que les decía antes fíjense que hemos 
empezado viendo que en la izquierda puede todavía  "
es,fPoJYgvRZJI,29,todos los parecidos que estamos viendo de esta crisis bancaria con la del 2008 si es posible que llegue a ocurrir lo
es,DcjUXXArBC8,209,salario lo doy a que kilian mbappé acaba en el Real Madrid este verano vale 95 % de mi salario a que kilian mbappé acaba
es,JGyljQ25uIc,550,"de San Diego fue un vuelo relativamente corto
rodeamos un poco la presa y nos dispusimos a sobrevolar nuevamente el pueblito de Río
Verde volábamos a una altura de unos 500600 pies que si no mal recuerdo Pepe me dijo
que eran unos 170180 metros de altura Ahora"
es,vSxwnbeALM8,128,históricamente aquí vemos diferentes rebotes como hubo en el año 2008 que es lo que pronostica al señor harnet y esos
es,5CtQfZQPfMc,96,que de partida podrás elegir solo entre ese gasolina solo entre S10 el que tiene además una versión de 4 ruedas
es,lNsEUiA2e0U,170,vehículos como el mg4 o como el Volkswagen id3 que precisamente serían los vehículos de la liga en la que va a
es,TuDhHLEVRvE,135,la crisis pero no llegó a suceder en 2015 o 2016 yo me acuerdo ahí con truebalio que también bajó como ahora y
es,K398OYnrIPA,173,hablando de un apoyo directo hacia bitcoin de más de 21 billones y repito más de 21 billones con b de todas formas
es,PxQqVG-7eM4,110,no han tenido la necesidad de actualizarlo en esta Beta 2 y ahora bien lo primero que he hecho nada más
es,4mu0VxqLMM8,48,"79 sino que lo tienen aquí hasta 7895 desde que 
hemos conocido el dato de China Hace unas horas a   las 4 de la mañana hemos visto ese comportamiento 
fíjense la caída hasta los 7896 sin embargo los   analista nos siguen apuntando ojo porque el precio 
del petróleo tiende a estabilizarse tiene tiende a  "
es,Ysi71IFSf3c,109,compré 54 cajas ayer como que se han acabado los donuts
es,t51AlDV41YE,184,día con la estabilización que estoy viendo ahora esto es un Galaxy s23 Ultra y vamos en una lancha no sé a 200 por
es,I6ZsvnRNBO8,36,Unboxing de montaje la cuestión es que viene limitado a 25 kilómetros por hora no os preocupéis pero el limitarlo y
es,9J30uX2BC0k,358,"semana que viene no esta semana me parece tenemos 
datos de inflación en el Reino Unido Y todavía   están van a dar cifras todavía por encima del 8 % 
no con cifras así su Banco Central no le queda   más remedio que seguir subiendo tipos seguir con 
tipos más altos mientras en el resto de economías  "
es,RFAp41OhUX0,153,comunidad de Madrid estará pagando un irpf de aproximadamente 31 .000 euros y con la reforma de vox pagaría un irpf de
es,joNBIdvgKYQ,152,jodiendo pero a ver Tengo un total voy a jugarmela al de 900 .000 vale porque Confío en Mohamed futbolista Pero bueno
es,a1tD6O0sHyE,180,que podemos y sus confluencias habían logrado por separado 51 millones de votos es decir que la coalición de
es,jh_gAq66-T0,53,"superior al 1 % al un punto porcentual en el caso 
bueno en este caso de Italia donde Por cierto el   dato armonizado se ha quedado en el 6 . 467 % Perdón 
en el dato mensual armonizado está en el 0 1 % de   subida de los precios cambiamos de asunto nos 
vamos Eso sí a Europa pero seguimos hablando de"
es,mmJOQRMLfTU,197,actualmente tiene el 99 . 9 % de la efectividad de sus ets presentados con un registro de 575 a 1 
es,tdjR6B4DxWo,8,París Saint Germain por tanto acaba contrato en 2024 de aquí a un año Ahí es donde el París Saint Germain dice por El
es,YWQf6Oo6HpE,4,el nuevo escenario económico que va a traer la agenda 2030 nos va a afectar a todos por igual este nuevo plan es
es,UjR1_925ekg,6,a hablar si lo estáis viendo bien en el título de iOS 16 .6 porque el jueves salió finalmente por fin la
es,8fdcosQhHNM,197,reloj hice un cronómetro y acá llegaron mis primeros 50 dólares en como desarrollador hice un proyecto
es,c9MYXZfTAQM,164,también tienen como las flores de Sakura por ahí detrás 50 yenes que también tienen florecitas ahí detrás estas son
es,IqvnsfUVXsE,13,Cruz Roja miquel es voluntario desde hace 18 años pero es la primera vez que le toca coordinar la llegada de
es,8nUniM0JZsc,116,Ahora nos muestra muchas más opciones posibles en iOS 16 4 donde elegir y con iOS 17 tenemos el
es,OzGhSyemuOU,65,no llega y el ascenso es bastante pronunciado pero con mis 92 kilos puede subirlo sin problema Así que si tú pesas
es,NMAUmZTBMME,135,un 20 y mucho mejor que el dow Jones quizá apenas un 5 % durante esos Pues 15 14 años que estuvieron gestionando
es,lATWanS1kcc,77,acuerdo comentaros que estamos en las últimas 48 horas para inscripciones se van a cerrar
es,RWLDcsUhJtQ,220,me ha ocurrido es intercalar un potenciómetro en este caso es de 10k en el hilo verde que es el que da la señal
es,ydTumL8g_rY,55,todo el mundo quería 1 pero si habían vendido unos 12 .000 en Estados Unidos y había más de 12 .000 personas que querían
es,FJ03S1VaGmA,122,mientras el motor no Se asiste de unos 100 km una brutalidad pero si queremos activar el puñito ahí será solo modo
es,Tu6VcHKpo2E,174,hay que saber es que todo aquel partido que no llegue al 3 % de los votos en su circunscripción no entra en el reparto
es,q8tE5cb9-p8,101,estaría este es el outfit hoy de negro básico como podéis observar son las 6 de la tarde o sea que en un rato hay cuarto
es,bJvcEN_qABo,109,Denver nuggets comenzó a tener mentalidad ganadora en 2007 y 2008 se clasificaron para la postemporada aliena
es,KhU6FG4nuTw,112,de videojuegos y me quedé hace 11 años [Música]
es,JxUybrzt-K4,11,resultados de las elecciones autonómicas en extremadura el pasado 28 de mayo el partido socialista de Guillermo
es,Sx4JCJ711pI,113,yo veo 2 frentes abiertos por un lado el Madrid lo tiene atado dejó Edu 999 % siempre se deja ese 0 con 1 pero
es,N7M7C1Nx9iU,208,en los últimos días obviamente yo no digo que el 22 de junio kylan mbappé haya firmado su contrato con El Real
es,ZehvAkRy6K8,425,"vivía el hombre en la época donde solamente 
dependía del campo y los animales y otra que   ha sido repoblada después de estar abandonada 
durante más de 40 años por un grupo de personas   y que han transformado en una ecoaldea 
igual que los chicos de la aldea de Barchel"
es,FdmcaBk2Djw,13,Madrid el Madrid tiene que entrar hasta la cocina 200 millones se le pagan primer fichaje se le paga Pero vamos a
es,axGlwsPHSug,207,ver tú A cuánto me lo compras vale esta me ofrece 5000 también o sea que lo compran por el precio Al que está no O
es,SU6cZ0v4EHY,-1,el otro día se presentaba el nuevo plegable de Motorola motor razor 40 Ultra con un pantalón en la parte de
es,0z5YOe_5Z-M,38,el poco f5 para hacer comparativa Pero es verdad que aquí con el Sony MX 766 que es el sensor que tenemos principal
es,N8tgv2pe1yU,127,como máxima tasa sino que todos como veis como poco como poco tendrán a 120 Incluso en algún caso se desmarcarán con
es,_A5XzruQ49A,62,plegable Pues nada no hay que hacer nada aquí tenemos su cargador de 2 amperios con sus pedales de aluminio unas cuantas
es,q9hFzMLqZQw,67,millones y esto lo tenemos que dividir por 1000 ya que youtube para cierta cantidad por mil visitas le damos a
es,8jaM73DhISg,113,crisis por ejemplo hemos ido pasando Desde 2020 21 de 1 .4 de billones es decir
es,K398OYnrIPA,176,bitcoin de más de 21 billones y repito más de 21 billones con b de todas formas Aunque todo esto aumenta muchísimo el
es,vRnV9k74nvo,193,llave solo es para sacar la batería la bicicleta arranca sin llave y así está 5 modos de pedaleo asistido y en el quinto
es,z021WI0ukqw,260,Atlético jugará no Conference 32 grados en Texas y en Madrid [Música]
es,c9MYXZfTAQM,122,billete de mil yenes luego está este de 2000 que esto me lo dieron el banco de España y apareciera aquí en Japón Esto
es,GmZXayREgAU,108,faltaba entre la etiqueta c y la etiqueta 0 pues les faltaba la etiqueta eco Así que lo que viene y os lo cuento
es,1XeQ8UnrVug,112,es lo de kylan mbappé en el día de nuevo 14 .024 de este culebrón entre mbappe París Saint Germain y Real Madrid ayer
es,aq38RX9X310,111,firmar más de 20 .000 contratos de refuerzo ampliar horario hasta las 10 de la noche y abrir en fin de semana vamos
es,lATWanS1kcc,192,titulo aquí es que si se puede estar repitiendo el año 2008 la última noticia que había era que vs había ofrecido la
es,urD40xdq1uY,11,y el desembarco de 1 de los grandes fabricantes de los 10 mayores fabricantes de China chery
es,fmGI1V4f3AY,43,momento tenemos el Beat Tank y el Beat ato3 que es el suv de tamaño mediano que seguramente es el coche que
es,xMZP7jNfEUg,138,todos sabéis este hombre se convirtió en dictador de Roma hasta el 44 antes de Cristo cuando fue asesinado tras él le
es,i6tHpJWnhEo,68,otras personas que han votado votaron más de 3 .000 personas entre inversores particulares y profesionales del sector
es,6t_4xf7ywB8,129,utilizo a diario las herramientas de microsoft 365 y podéis quería recomendar la academia de empecé componentes que es
es,NyDSYlamnIA,36,tengo todas las consolas de Pequeños O sea la Nintendo DS la 3DS la Wii U me compré también que mucha gente no la
es,3GiHiCFCMLc,109,construcción aleación de aluminio un peso total de 156 kilos y soporta una carga máxima de 100 kilos Así que si
es,3OAQffhQxxE,55,parezca da igual en el sector en el que inviertas ya sean acciones y 10 o criptomonedas que en todas ellas nos va
es,7I1fAJDhSC0,154,Filadelfia promediaría 45 puntos 15 rebotes en 74 partidos desde el banquillo pero con el paso de las
es,hCMeGjDhClM,34,contaremos todos los cambios que traiga si recordáis la primera Beta de iOS 16 .6 traía en los ajustes un menú oculto
es,1eR1H_ema4M,179,que tienen ver de 40 y pico kilovatios hora y luego saltan ya a los 60 y pico o los 70 y pico este se queda en la franja
es,QDXLIHQH6ic,203,contarte como Mejora y que me parece totalmente genial número 3 el sistema de clima del watch es re lindo es muy bueno
es,-aPV0cEwd8c,16,dobles frenos de disco mira como rasca la rueda con sus 500 vatios de motor su posición de conducción aumenta el
es,X67kr4vy9M8,199,es tremendo fin de semana para olvidar Está bueno recuerdo está 6 puntos de Mercedes en el campeonato está tercero
es,hWSXAzjgTwk,58,pasado mes y ahora quieren que sobre esos 10 puntos se establezca un nuevo tratado de paz desde el alto el fuego y
es,B2c2aS2AIFY,4,para la evolución del precio de bitcoin con subidas de más de un 100 % e incluso de más de un 200 % en pocos días que han
es,AshN_ccUW-g,96,dentro las cuerdas no 15 minutos más que la ves
es,r5Y4jPZnspM,129,que otro factor muy importante de este s23 en esta situación que ya estamos llegando al verano mantener ese pico de
es,P9dPihAQE9M,204,"desayunar Así es un gustazo 60 coronas hemos visto a lo lejos un pueblito diminuto 
al final de esta carretera por estos Prados  "
es,H-5v_jDgzzU,0,2013 biblioteca pública de San Francisco un joven de pelo castaño de 29 años se sienten una esquina con su portátil por
es,wSMtt13nf80,80,crecimiento interanual a final de año del 5 % pero china esperamos 6 china esperaba recuperarse del movimiento del
es,o71_7IhGcQA,66,pondrá a distribución para que le llegue a la gente hasta el día 18 ya se ha hecho ese recuento de todas las
es,REVwuOr3eL8,41,simplemente decir la compatibilidad de guacho es 10 y es exactamente la misma que con guacho es 9 todos los Apple
es,AftKoCG29CU,316,"Estaba haciendo otras
puestas en marcha y otras empresas pero finalmente regresó a
tiempo parcial alrededor de 2006 . Y desde 2010 u 11 a tiempo completo y"
es,mY1Yoq5dI2Q,165,cuando saca la camiseta y pone 2025 cuando al final era 2024 más un opcional Pero bueno no vamos a decir
es,T1lDKbIQcLg,105,potencial las acciones de GameStop llevan cayendo desde 2016 para 2019 su precio de un desastre llegó a beber un
es,byL4wmQvA70,119,que es el mini submarino de toda la vida de GTA 5 luego Aquí también tenemos el Kraken que es 1 así como más más top
es,SYcMeUWgTck,161,fortaleza mental y física el parko le pida tío por algo llevo yo 17 años saltando y no me canso cada día descubro
es,N8tgv2pe1yU,0,el otro día probando el nuevo Moto Edge 40 Pro pensaba vale otro móvil que en este caso viene con espectaculares
es,_0ZB971wA1c,154,preguntan a quién van a votar en las próximas elecciones del 23 de Julio en principio y aunque 1 sea de izquierdas
es,AGiayASyp2Q,135,suenan tanto que están tan extendidos y utilizados son lenguajes que tienen 30 años porque también tenemos que aprender
es,JjpXtf82KcM,104,conectividad más funciones más opciones Y en este caso podemos conectar hasta 6 monitores Pro display a la vez vamos una
es,Nn-95HenTHY,184,motivo de debate con blon y con Bruno campo 013 que son nuestros colaboradores de los lunes en este los lunes al gol
es,R9t-5PSvwQw,102,dicho esto que ha dicho a los compañeros de tf1 Así que vamos a reaccionar empezando con esas declaraciones Y esa
es,gFxGg9_RnlY,29,si estuviéramos en Andalucía pues dirían esto es un Esto para mí es nivel 1 no O sea media hora
es,AdbzI9qT_5Q,70,caso dentro de Windows ya digo Windows 10 o Windows 11 lo más sencillo lo más rápido pues ya está habilitado en España
es,gxUefMJIKbg,67,puñito no funciona o sea no se comporta como una moto Así que vamos a ir 100 % legal por la vía ahora viene el tema de
es,pyI9fvdgF8I,6,participación en el yin usai como assistant coach en el Mundial 2002 quedaron en sexto puesto en 2004 fue
es,Rw3LEGlY578,380,Carlos lo tiene que ahí lo vemos justo la vuelta recordáis en 2020 unos 5 o 6 a 156 que es un tiempo pues eso es muy
es,wqR9JOxhfZw,467,premio de Austria Bienvenidos a este gran premio Sprint carrera Sprint 24 vueltas estrenamos no nos estrenamos es
es,zL2s4uKSAow,38,amperios lo carga más o menos en unas 5 o 6 horas como mucho tiene 156 amperios hora Su batería y atentos corre 41 
es,_gHMJDrFwqg,4,año lo tengo claro por este lado el preciosísimo Galaxy a34 Y por aquí el que promete ser el móvil soy yo de este
es,0KvaC363VG8,157,pues buscar en internet directamente modo recovery galaxia 14 es lo que he dicho yo antes pero bueno por si acaso
es,Jwh6_9hM1YM,39,pero están bloqueado muchos con más de 100 millones que dices al final me da un poco igual porque pienso yo lo que
es,J8wQOCvCwRs,64,precio la mejor opción qué es lo que pasa con el Google Pixel 7 Es recomendable sí a día de hoy si te lo
es,FYmF71zPTkg,199,del presidente Vladimir Putin en el año 2000 de hecho Putin es un antiguo oficial del kgb y por lo tanto
es,5GVGomIdl7g,18,[Música] año 1883 Nueva York 2 hombres pasean por el recién construido puente de
