lang,id,time,subs
es,5j-mw01Ctsc,30,vamos a hablar es de la toma completa de la ciudad de Back mood tras casi 10 meses de combates Y es que finalmente el
es,yZeZpiW2gKw,18,conocedores del poder que poseen más cada 1 tiene un total de 10 invitaciones por lo que solo es cuestión
es,8S-mNM2pi0E,19,que hemos ido viendo en betas anteriores recordad que en la Beta 1 de iOS 16 .6 podemos ver como Apple dejaba ver en los
es,hoZCzUOqdWw,128,acontecimientos claves para entender todo lo que ocurriría después en 1776 se aprobó la declaración de independencia
es,GEPeqwQLKIk,51,versión de 140 caballos y pensaba que estaba conduciendo la de 200 la de 196 Y cómo es eso posible diréis Cómo no te
es,8S-mNM2pi0E,68,G 50 58d y es curioso Porque si os acordáis la Beta 3 también acababa con la letra d a ver esto no quiere decir
es,uK7jhEglSfw,188,no me lo cambies por ahora me haces una IP nueva me haces Dragon Quest 17 y el personaje es una chica negra Felicidades
es,aq38RX9X310,109,solicitudes ha obligado a correos a firmar más de 20 .000 contratos de refuerzo ampliar horario hasta las 10 de
es,tOteXrG6gus,172,también teníamos el mismo módulo de cámaras que veíamos en el mi 11 de aquel entonces pero como habéis pasado el
es,Yg4pVeUF478,34,el one Plus 11 utilizo durante unas semanas el vivo x90 pro y me paso esto y lo único que digo es vaya por qué no
es,mXKhC4Y2v_M,26,cerca en este caso tenemos motor delantero de 36 voltios 350 vatios hasta picos de 500 cuando lo requiere y esas
es,2BXehT5-p-Y,72,una pulsera de actividad para mí como smartwatch es algo así un redmi watch 3 active Este vídeo os digo que no está
es,u9XUBatZIj0,0,25 intentos de escape fui condenado sin prueba a 35 años pagué 10 pasé por 16 cárceles
es,o1bp64ELo-s,60,hoy desayuné solo pero realmente tengo compañía ya que estamos viendo al 9 en el mismo piso
es,Sx4JCJ711pI,250, 9999 % por el Real Madrid para el año 2024 Es verdad que yo al principio tenía
es,ArBnj7rKjX8,70,vosotros si conseguimos 30 .000 likes en menos de 24 horas ahí está el vídeo por cierto una cosa
es,iHuJU64crBg,188,5 veces es decir cadenas de compradores de hasta 5 personas y no el mismo día pero la mayoría de las cadenas
es,I01r7cH4Ydc,118,normal pues si tiene la batería pongamos 60 kilovatios y en casa Tienes contratados 6 pues 60 entre 6 10 horas
es,xpm8-5-ElZo,5,ver lo que ha comentado el fmi porque cree que a nivel económico el 2023 pues va a ser complicado que podía implicar
es,UMeGExMLSxw,96,dice 15 km en el modo más potente en cualquier caso lo dicho 8 amperios hora no se alcanza para 15 km en el modo más
es,XyiQUBNl8zE,133,mucha gente subita ahora en 2 minutos hay mucha gente avanza un poco avanza un
es,qFKSKlzDmtE,201,información que te va a ayudar a descargar esos 119 GB de contenido pirateado Lo cierto es que a día de hoy
es,r6PeAIKTcL8,77,principal sitúala a 45 grados de la cámara o sea del móvil alta e inclinada hacia abajo
es,kY3FuwTN9U0,140,aparecer en el mercado con esta actualización 2023 que trae algunas novedades que te voy a relatar en este
es,fsAvhvN9d0M,13,llevamos 2 semanas con este trípode tiene 240 centímetros de altura vamos una auténtica locura las patas son en
es,liL7DR25eVs,93,Colegios del Estado su rapidez y decisión su compañerismo en 2016 Se comprometió para jugar con el baloncesto
es,WatTqrq8kQQ,115,las dudas sobre un lenguaje Así que bienvenido y bienvenida a este día 2 de un día un lenguaje vamos a dar nuestros
es,JxUybrzt-K4,30,obtiene los mismos diputados que el partido socialista 28 En tercer lugar y a bastante distancia nos encontramos con
es,3HSYMpj7j70,130,múltiples idas y venidas de distintas dinastías llegaría a durar más de 2 .000 años casi nada No pues con Los King que
es,sAw2Vlgmkvw,75,tiempo espera purificar y refrescar eso es más bien 2 en 1 no no pasa nada como os podéis imaginar esta habitación está
es,1hrHMeH0MOw,162,es donde viene lo más importante donde podemos encontrar esas 100 .000 emisoras organizadas de diferentes maneras y
es,HXTPyV_OdDo,139,ha nacido todo Samsung recordemos que en Corea del Sur El 35 % del producto interior bruto Es de la firma coreana
es,KhU6FG4nuTw,262,otra cosa porque si no no atraería tanta gente cómo era hace 11 años la verdad Mira yo para mí era todo raro o sea pero
es,B2c2aS2AIFY,199,de la reciente bajada por debajo de los 20 .000 dólares a principios de mes con toda la polémica de los bancos desde el
es,20gYg45Maqk,45,como mínimo hasta las 4 de la tarde las 8 gmt por lo tanto importante lo que se está viviendo está jornada en la bolsa
es,M4q7AEGF0yA,192,29 millones y apretáis Machine solo por 35 mil dólares Oye es una ganga o sea yo la
es,lqQC4dMmUQ8,73,vamos a hablar de un tópico muy interesante Cómo poder retirarnos en 10 años y para ello vamos a analizar en
es,vwAoTDalIps,35,sé cuándo O sea Raúl era marcado Ya pues no lo sé como 1 .52 goles por partido por entrenamiento y la verdad es que cada
es,26hKuWJcodU,42,no fue fácil crear la verdad en 10 kilos de golosinas [Aplausos]
es,QmOGdGuarX4,114,echamos un vistazo al gráfico de bitcoin desde finales de 2022 su precio ha experimentado unos cuantos meses de su
es,SU6cZ0v4EHY,12,una pantalla que ha crecido Hasta las 3 con 4 pulgadas en la parte de fuera y además es Interesante como Motorola dejó
es,eoPZ9_ZAOCg,273,nada veo que este no es mi examen de que era el examen del tema 1 o tema 2 Oye bro Cuál era la respuesta 3 tío
es,e5q6IjZQXs8,104,eh yo creo mira mira eso sí tenía una cosa buena y es que el 0 a 100 no era tan malo no era catastrófico al menos
es,lZVRMcib2u4,222,caja nueva es decir nosotros teníamos una caja para un vehículo 4x4 que así es originalmente la sayoneta si es verdad
es,2JbekXAtveg,164,mucho pero es que Zelda es una empresa enorme genera más de 9 mil millones de de facturación anual y un beneficio
es,1eR1H_ema4M,155,motores y todo eso pues muy racional este coche tiene una única batería de 54 kilovatios hora que es lo que la marca
es,Ik1uTdDG71g,266,al reactor info costó 2 mil millones 2 mil millones lleva 30 años abandonada y
es,35OEgU_HbOY,43,seguir avanzando se ha ido acumulando el déficit de los últimos 15 años hasta crear una deuda pública que
es,CsMXJ7JZmPs,106,de la bolsa porque la tasa libre de riesgo que es el bono a 10 años y demás pues empezar a reflejar esto y luego La
es,KOl5mjCYIfY,158,tiene su nombre muy bien la verdad es que poco podemos decir son 227 gramos es bastante grande en el bolsillo se asoma
es,QOWbL719XZI,355,un programa de Chiringuito y nos vemos el 7 del 8 como todo el mundo sabe Bueno a lo mejor lo permite
es,dKN3DS0APRY,121,finales porque en el año 25 tiene que entrar la Euro 7 Euro 7 concretamente para turismos y para furgonetas y
es,sAw2Vlgmkvw,22,apareció este anuncio esto es un aire acondicionado portátil 3 en 1 es ideal para purificar y refrescar cualquier
es,tOteXrG6gus,4,lo he comentado muchas veces para mí la paz 5 es una de mis tablets sino mi tablet favorita en este Rango de precios
es,PzePdN9mctU,67,sobre todo su motor de 500 vatios con picos de 1000 con engranajes planetarios es brutal yo creo que todos los
es,8k_Ab1HT7sI,178,también el 1 de los peores es que me sobremes es 0 .6 lo cual han analizado pues daría más de
es,TMU9_-I5gw4,55,mercados y acaba sucediendo algo parecido a lo que ocurrió en el año 2019 y después analizaremos y toda esta
es,uSzUyuatHms,70,revisiones en los coches si en los últimos 20 -25 años la tecnología en el mundo del automóvil ha evolucionado un
es,DALx7G3FeI0,212,contrato de 90 millones Nike eligió el dorsal 23 el mismo que llevaba Michael Jordan al que considera su ídolo y
es,zZf5WtPRSWU,117,fue la más tremenda que se recuerda en los últimos 40 o 50 años de hecho ha habido muchas compañías que pasando de
es,rviSug3HN60,79,compraré más tengo también el último tomo que salió que es el 103 Es que aquí valen como 34 euros o sea es una
es,K5l3PecRikU,316,lejos a ver siempre hay una cerca eh siempre hay una cifra pero no son 50 Ni 70 son cerca yo diría que mil si no no
es,B3Sjnfuvwv0,15,chiquita A sus 30 años Sam sbf para los amigos ha sido portada de la revista fortune por
es,Fh6_dmtJMPI,34,cámara principal de 200 megapíxeles un gran angular que es Macro de 12 megapíxeles una gran novedad las fotos
es,d43kF_6YYmM,136,el segundo gestor de activos más grande del mundo y en más de 5 billones al tercero que es fidelity investments otro
es,MSnRmIbwlFk,29,400 personas y este año vamos peor y han muerto 184 en la última semana 23 puede ser 1 de los años donde donde más
es,MkW4d8TlXG0,139,facilidades a los créditos bajando los tipos de interés del 6 % hasta el 1 % en 2 años todo ello mientras poco a poco
es,xuOcMXp6N5g,69,comenzará en 2024 autopistas señor señor en el vídeo que específicamente
es,_4rGlJIRf0g,36,nuestro fondo de renta fija está por encima del 5 % y el más conservador por encima del 3 %
es,gbWAXmkZNog,185,permanezca permanentemente encendida o en secuencias de 10 30 o 60 Segundos también decides el modo de entrada que
es,UrIAA-ebM38,196,puntuaciones en Single Core 1878 y en multicore 5 .370 traducido que no ha habido mucha variación en cuanto a
es,pn2PEMzQWyY,187,coche con una diseño de la carrocería impresionante en esos casi 5 metros de longitud que tiene con placas solares en
es,MkW4d8TlXG0,183,demanda y haciendo que los precios subieran más de un 50 % en pocos años lo que supone una de las mayores
es,u9iciQb4WoU,101,universidad la USA exclusivamente tiene un iPad de 11 pulgadas un iPad Pro procesador M1 y lo utiliza muchísimo
es,TJBmEHtX454,318,Y esta es la victoria perfecto 2 soles este señor va a ser nuestro gondolero
es,mncYO2UH_30,29,muchos lugares que visitar dentro de sus 23 barrios sin duda alguna el barrio más famoso de
es,2_khL_UBBnI,11,afición que jamás se separó de ellos una campaña 2023 imborrable con 53 victorias y 29 derrotas y unos playoffs en los que
es,vTOdSFekKEY,31,barra cuadrada de acero de al menos un metro de largo y 35 de ancho luego esta barra la cortas en 3 partes iguales
es,Ln6uC-CEHVM,203,personaje que se podría decir sí que Final Fantasy 10 es mi Final Fantasy favorito pero ojo cuidado con el 16 los
es,Tu6VcHKpo2E,49,sino que elegimos al poder legislativo es decir a los 350 diputados que forman el congreso de los diputados y a los 266 
es,dr5x8yFQIa4,179,versión 12 tienen el mismo diseño Así que es el 12 es el que se ha salido un poquito de la Pauta Y ya cada 1 valore
es,20gYg45Maqk,102,anticipan Un inicio de sesión para la bolsa europea con caídas de acero 60 % en los futuros del dax mientras también
es,BOm9mv8JsDY,184,"Dani. A ver el Rum Rum si
es tan fuerte como dicen... Sumamos eslingas. 
La nuestra de Sáhara 4x4 de hace mil años. Y
luego nos hemos fijado que"
es,kAhIO1nx6FU,70,caso no podríais vincular un Apple watch con watch 10 a un iPhone con iOS 16 vale cuidado con eso dicho esto comenzamos
es,_COZAsJL_UU,163,que venía haciendo estos meses con lo cual la gente proyectaba ese 02 pues decía bueno el año que viene estaremos
es,SQYPVpoRBVU,27,puede ser de otra manera de 2 productos de Amazon con más de un 60 % de descuento el primero de ellos es el fire
es,YWQf6Oo6HpE,93,bien esta agenda 2030 ya se diseñó en el año 2015 y llevamos 7 años desde su implantación y ahora estamos entrando en
es,GeQxaDaqi10,215,mega descuento de gibbajin se queda en 850 euros por lo tanto para mí es un precio flipante para este producto yo os
es,ClS2pwggzaY,96,pequeño como por ejemplo podían ser los Galaxy buds 2 Pro pero que tampoco se va mucho de tamaño como otras soluciones de
es,VWZt7c2BssA,187,no pensaba que iba a llevar tanta tecnología dentro lleva Bluetooth 5 .3 no podía ser de otra forma que nos ofrece
es,tGJXzk1E3g0,136,igual forma con la misma comparativa que hablábamos de el iPhone 14 promas que creo que no tiene sentido a día de hoy
es,AGZzsW7noBo,148,podemos quedar sin batería por lo tanto qué tenemos aquí 52 voltios 18 amperios hora capaz de alcanzar hasta 60 
es,FtWcuysFQng,156,la Euro 7 fuera en el año 2027 valga la redundancia en lugar del año 2025 Eso es lo que me llega que se está intentando
es,KczhWiCUeIM,167,es cierto con sus aptitudes fue un jugador no drafteado en 2002 aguantó francesa durante una temporada pero 12 
es,zZf5WtPRSWU,185,mercados bajistas suelen durar entre 1 y 2 años llevamos ya un año entonces es posible que se resuelva en 2023 ahora
es,L-L6I-zjiQE,182,"es el que más fuerza le da a Box en 
la negociación Miren el siguiente   le hemos dicho empezamos por la izquierda 
vamos avanzando a la derecha ga3   el español luego ga3 en español más fuerza para PP 
33 y medio de votos por ciento 143 más 37 mayoría  "
es,B3Sjnfuvwv0,165,que en esa época estaba ganando 25 millones de dólares al día 25 millones al día cabe decir que esas cifras no se
es,amnQZbkkHP4,9,sufrir un accidente aéreo y pasar casi 40 días deambulando por la selva Vimos una bebé completamente recuperada en
es,y-ga69_IwYo,60,era difícil bajar de 2 minutos tiempos dignos de un 911 pero como digo Aunque iba muy bien el
es,ZehvAkRy6K8,217," antiguamente estos eran terrenos baldíos   que no tenían ningún valor hasta el año 
1970 eran chozas de pastores y ganaderos   esta aldea también es la entrada al parque un 
parque muy importante el parque nacional de doñana  "
es,kAhIO1nx6FU,22,bueno en este momento cuando estoy grabando Este vídeo es iOS 16 Precisamente en este vídeo os voy a
es,LFI1BqfOt0E,106,van a pagar cuánto me van a pagar de sueldo está [ __ ] eh reúne a 10 personas en el restaurante vale a ver
es,SQYPVpoRBVU,153,y está hoy por 110 euros cuando se ofrece de salida es de cerca de 200 euros Así que no está nada mal llegamos
es,FVRgffZjcC0,99,"Vamos vamos bimba visitemos vamos vamos castillo del siglo 13 chicos de estilo renacentista
en que entraba entremos a lo grande bimba por el castillo"
es,FJ03S1VaGmA,32,interesan ese motor a ver a ver cómo es en este caso tenemos una bicicleta 100 % legal entre comillas os lo voy a
es,deI2N_c0nHk,768,"vamos a echarle un vistazo a 
la imponente Basílica de Puebla vean tremenda basílica muchachos construida 
entre los siglos 16 y 17 fue la primera iglesia   mayor del Nuevo Mundo con una fachada barroca 
y esas 2 Torres Gemelas de unos 70 metros de  "
es,efGQ0vFUUxM,118,enseñó a ganar dinero con canales automatizados más de 6 cifras al año en sus fotos se ve que tiene bmw chalet con
es,QlmpsvnRKZg,143,venezolana Enrique capriles en el año 2013 Enrique Capri estuvo a punto de ganarle las lecciones presidenciales a
es,zCAM4E8MVPs,32,"equivoco en San Pedro San Andrés Porque son
2 pueblos que están súper pegados está San Andrés de Cholula que está muy cerquita
aquí a solo 15 minutos son 2 pueblitos que están conectados bueno nos han recomendado
venir acá porque acá está lo más grande"
es,9dn1ALQw7TY,41,gigantescos para un aficionado que no quiere dejar de tener este 4x4 clásico que ahora ya no se vende un movimiento
es,pJOjSdF5jl8,3,de duda por muchas razones primero porque puedes escuchar hasta 100 .000 emisoras de todo el mundo sin ningún
es,3GiHiCFCMLc,236,aquí tenemos sus ruedas trasera y delantera de aire y son de 85 pulgadas vamos a ver la trasera más de cerca y
es,hWSXAzjgTwk,151,zelensky está intentando ahora mismo redoblar los esfuerzos obtenerlos de 16 obtener drones de combate Y obtener lo
es,ZI3qDJdhOcc,190,escribía en trámite al niño bueno genial perfecto un 3 esta es una de las cosas 1 de los
es,J8wQOCvCwRs,8,si a día de hoy merece la pena después de 8 meses desde su presentación gastarse 649 euros en un píxel 7 un
es,_gHMJDrFwqg,59,diferentes aquí ha decidido apostar por una línea similar a la de los s23 de este mismo año con esa triple óptica que
es,dLp7HNyHojk,74,son 41 litros a los 100 o lo que es lo mismo 93 gramos de CO2 de emisiones Y esa es la gama de motorizaciones la
es,w3sHpEAZfhk,30,Durante los últimos 30 años esto significa que 10 .000 dólares invertidos en su fondo de inversión valdrían hoy
es,Tgz_ZYoQIkw,81,[Aplausos] 20 participantes [Aplausos]
es,ISMKECeFxZo,66,normales y 2 pro con los mismos tamaños de pantalla que hasta ahora 61 y 67 pulgadas no obstante se espera que
es,lPNNwD4ehac,65,vuestra página web en Rayo la tienen servicio de atención al cliente 24 horas tienen un soporte experto en wordpress
es,n_VOSQhRoOg,196,Sergio Rivas y por eso en un principio el precio de salida es de 10 millones de euros que es una auténtica locura de por
es,pES9ufXV1I4,178,todo y por otra parte también tecnología hdr10 Plus en refresco yo particularmente nota la diferencia pero
es,q9hFzMLqZQw,85,mes de junio yo gane 14 mil 400 euros qué voy a ganar yo 14 mil 400 euros vamos a ver él está dando por
es,nS5DPuFu4sw,204,recap hace ya más de un año concretamente en junio de 2022 vimos la evolución del portafolio de Julia
es,lATWanS1kcc,203,vale esto supondría una minusvalía que Credit chuix habrá en menos 86 % el lunes si se consuma la compra pero he estado
es,e_tAM4zYacc,99,estuvieran gastando insisto elevándolo un 170 por ciento respecto a enero y junio de 2022 que se dice Pronto yo voy
es,UKBfxtfGZLE,122,verde se ponga en rojo teóricamente es cuando ha llegado a ese 20 % por en ese momento me detendré y diremos pues
es,65IbZg3kG7E,91,versus bache Esperemos no quedarnos sin coche de 300 .000 € y pilla velocidad vale Yo creo que con
es,hp0V-JVzaF4,77,hora de oporto pues me dan y don bulls y eso que me he levantado a las 7 de la mañana me he cogido un bus aquí que ha
es,veTngOkJ_dY,33,dijeron que no podía que es que no tenían cita hasta las 2 :30 y claro Yo decía pero es que yo ya conozco que no
es,X5sfrpWgB5U,90,5 y otros están como en un punto intermedio como el 2 y el 4 pero en cualquier caso también depende de que
es,GNU1MUUEqt4,215,lo que se llevará Pues no sé si 10 millones o el 10 % el traspaso son 200 A lo mejor 20 son de
es,7I1fAJDhSC0,151,buscaría su momento como Novato en Filadelfia promediaría 45 puntos 15 rebotes en 74 partidos desde el
es,DcjUXXArBC8,18,mbappé acaba en el Real Madrid este verano 95 % de mi salario a que kilian mbappé llega al Real Madrid buff
es,EGTaNyV1cMU,109,[Música] tardo aproximadamente 15 minutos en ir a clase y el camino es precioso entre
es,-ipv8pwnP0c,109,consideran o que son bastante favorables a él un 49 es el que tienen estos momentos Robert Kennedy Union el apoyo a
es,fo3TgK6bcvQ,60,memes que junto con el lanzamiento de la brc20 en marzo ha inundado la red de bitcoin de una gran cantidad de nuevos
es,3OAQffhQxxE,120,de forma que si pides un préstamo de 1000 euros a un 5 % anual en este caso tendrías que pagar un interés de 50 
es,kY3FuwTN9U0,87,voy a contar todos los cambios en el 2008 qué tal va Qué tal es y cómo les ha quedado esta nueva versión que va a ser
es,y9LEShxR0Kw,45,desplegar su mejor juego y pueda ganar a Djokovic el número 2 Así que este domingo se espera un vuelo de altura
es,RFAp41OhUX0,224,euros sino 2 .700 euros y la propuesta de reforma fiscal de vox No termina aquí en materia
es,WeMe2_yXw8A,107,psiquiatra estaba equivocado y siguió con lo suyo en el año 2000 dejó la medicina y creó sesión capital su propio
es,nFoe-Cf2As4,53,luego 345 luego a las 4 y a las 4 te dicen que a las 5 y luego en vez de a las 5 empieza a menos 20 Pero bueno da
es,sAw2Vlgmkvw,98,consumo 7 vatios casi agotado por el módico precio de 37 con 90 euros pero el que está rebajado porque antes valía 60 
es,b-z-Sj3wmJA,102,dio un poco de miedo a partir del 1 de abril en los últimos 8 o 9 días el gasto pone aquí que
es,w3sHpEAZfhk,163,invertidos a inicio este fondo se hubieran convertido en más de 200 millones de dólares jimmer fue pionero
es,GgFKRgyMpDs,136,sigue Ardiendo amigo cuánto hay que esperar para poder tomarlo 20 minutos un poquito mal
es,2BXehT5-p-Y,152,pantalla de 183 pulgadas que sí no es amoled es un panel ips con 450 nits de brillo que os tengo que decir que como
es,i3t4b0yP2ZE,101,trovaleosmallcaps porque por folleto al bajar de 80 millones pues se tiene que reabrir para aceptar los inversores
es,nEE438wSm3I,76,superior a 10 es decir dentro de nada vamos a tener como 10 marcas extra vendiéndose en el país pues está claro
es,DALx7G3FeI0,26,mejores de la historia acompañado siempre de la mano por el del 84 Y 96 grandes nombres sonaban para ser
es,AGiayASyp2Q,160,oficialmente fue en 2012 Y entonces lo que llevamos son 11 años gente que Go directamente goulo desarrolló Google
es,VTA4rtqvnBM,33,ninguna novedad en cuanto a funcionalidades en la Beta 3 la app de Buscar añadió soporte para los nuevos
es,awM5QFp4bHw,58,va a ser determinante en la victoria socialista el próximo 23 de Julio qué sensaciones personales tiene sobre cómo
es,ZI3qDJdhOcc,308,quiere ver desde fuera qué haces hay 2 [Música]
es,8k52HKAiemo,16,patinete de gama media así que si tu Ruta no va a ser superior a 15 km deberías verlo porque realmente Bueno a
es,CG9GIvO4jPM,189,incrementar un 34 hubiesen incrementado un 21 % Así que se nota aún así cuanto ha sumado esta esta compra de ferrepublic
es,aqGwTVrKqI0,12,www.dc Hoy es el turno de hablar de iOS 17 Pero ojo qué tal rinde iOS 17 en equipos un poquito más antiguos Como por
es,OGj1JcxEHLo,86, 54 % es decir que a partir de unos ingresos de 300 .000 euros Que obviamente son ingresos que no tiene la amplia
es,g7wdDaiPgfY,37,funcionamiento importante verdad 200 metros es lo que viene especificado la prueba que hemos hecho no ha sido tan
es,Dc2luZ04wUU,146,subidas de tipo se espera en la próxima reunión del día 2 está la próxima semana hace 75 luego puede que se haya 0 . 5 
es,03Sja1uo8DA,30,litros es hice 1000 litros y digo qué qué 1000 litros o sea mil dólares te gastas eso en 2 meses y encima hace
es,qXmstedUsrk,263,hacer frío y tú estás ahí en el agua caliente 11 no es como Pues un baño termal la mayoría son separados por
es,svQmZg0a60U,294,casa quiero hacer el 5 y ahora que el 8 y ahora que el 9 es la importancia de las progresiones chavales si queréis
es,WyJm9--PZHs,67,impartir oficialmente esos títulos el próximo 2 de octubre y como parte de la misión de la Universidad de las x
es,GEPeqwQLKIk,151,sobre todo si tienes en la retina como tenía yo Tanto las versiones de 122 o anteriores que habían tenido ese sistema
es,vuViDCeE_rg,121,cargador de 3 amperios podremos cargar el patinete de 0 a 100 en una 5 horas [Música]
es,jh_gAq66-T0,37,"precios sigue siendo elevada en términos anuales 
 64 % esto supone aún así una caída muy importante   respecto al dato que teníamos el mes pasado que 
estaba muy por encima de ese 7 % por lo tanto caída   superior al 1 % al un punto porcentual en el caso 
bueno en este caso de Italia donde Por cierto el  "
es,QIe5r2npEtE,111,subsidios al trigo y al combustible que hizo que en 2018 esta ya se la revolución sudanesa a Alba sier no le
es,lNsEUiA2e0U,158,bastante pero si esa cifra es importante lo que es más llamativo son los 27 metros de longitud que tiene la batalla
es,GmZXayREgAU,53,empecé a estudiar esto de la Industria Del automóvil de niño se tardaba 8 o 10 años en desarrollar un coche luego 5 
es,glu4048ehwI,187,[Aplausos] que habría no sé 30 40 personas como mucho esas fueron las oleadas de
es,8jaM73DhISg,89,gobierno de Estados Unidos insisto un 15 % a 646 mil millones en junio es está siendo espectacular el gasto que
es,3Ve1AY5Ztss,98,principales fuentes de esta noticia este Imac de 30 pulgadas estaría aún lejos de lanzarse bueno sugieren que podrían
es,elrKgU5Dhg0,146,tener en murcia capital máxima prevista de 32 en Valencia y con valores más altos en el interior de la provincia
es,z021WI0ukqw,244,el athletic juega en Europa dice llevan 19 :30 Pues cuando haya decisión firme de la
es,xwbT6OfJtJU,150,originalmente esta deuda por tan solo 100 millones de dólares y consiguió recuperar más de 1 .600 millones de
es,1NelbgsuAN0,12,cuenta el segundo la pantalla así como el 13 Pro no me parecía muy muy interesante aquí tenemos un brillo
es,hjDsjhHr5XU,29,casi parece óptico hasta 4 aumentos todo por 500 euros aproximadamente así que un gran trabajo de realme en toda la
es,a-voKcUd3-Y,164,dice Sí sí como no renueva se le va a vender 300 millones de euros sí que quiere 200 millones de euros ya
es,ydTumL8g_rY,29,ahora mismo pero cuando empezó a tener precios de coche usado cuando por 20 .000 te podías comprar 1 es cuando los que
es,L-L6I-zjiQE,327,"report que nos refleja esta mañana la mejor opción 
para el partido popular aquí en este escenario Box   no tiene nada que ver 155 en tienda Melo y ahora 
lo explico No tiene que hacer 155 partido popular   27 Bots de 52 que tiene ahora se tiene que sumar 
a negociar se tiene que sentar perdón a negociar  "
es,qCKY8vGHuzE,172,lanzado para el Apple watch y que sepáis que si instaláis también guacho es 9 .5 tendréis una esfera que va a juego
es,TJBmEHtX454,225,Esta es conocida chicos como la Venecia de México hay más de 180 kilómetros de canales abiertos de canales más o menos
es,YpVqnS6QYlQ,35,exigieron un recuento de actas y lograron paralizar durante 20 días la publicación de los resultados el
es,FVRgffZjcC0,683,"es impresionante el pueblo fácil de recorrer no es muy grande tiene
solo 13 mil habitantes todavía no hemos probado realmente los típicos
platos de aquí de la República Checa la"
es,B3Sjnfuvwv0,175,para invertir después de esto se fue a vivir a Hong Kong y ahí fundó en 2019 su segunda empresa ftx una plataforma de
es,NMAUmZTBMME,91,una Clara contracción Vale y los datos del empleo llevaban 14 trimestres batiendo expectativas mucho
es,evj0mwLg-M0,179,luego traerlo No no es una cosa que empezó en 2019 hace ya 4 años Vale dice en 2019 empezamos a pensar en cómo
es,I01r7cH4Ydc,197,a ser bastante breve unos neumáticos michelín a los 50 .000 km y otros exactamente iguales a los 100 .000 su
