lang,id,time,subs
es,Zw5QL3-Zyio,165,también en el guardabarros y podemos subirlo tiene un peso de 243 kilos que nos ofrece la posibilidad de subir
es,KOLjbnD_n_8,122,entregó más de medio millón de dólares que equivale atención al 6 % de todo el presupuesto de la seremi de vivienda en
es,dr5x8yFQIa4,75,está entre medias y ahora veremos algunas diferencias porque claro de 128 a 256 ahí también 10 € y también sería
es,-aPV0cEwd8c,26,llenos de baches si te gusta tengo un cupón del 8 % de descuento solo has de ir a la web de smarciero y aplicarlo y no
es,mh2mIFRu0Dc,133,cayó como agua de mayo un equipo que no veía los playoffs desde el 81 era el juguete nuevo
es,w07AoCLx6j4,225,hacer el check-in y todo esto que ya estamos mil 5 minutos han tardado luego según house tour bien
es,c8J0ZjclcDE,12,bastantes temas interesantes de Cómo afrontar el 2023 Qué riesgos puede haber hablado de En qué tipo de acciones
es,2JbekXAtveg,176,empresario de la Industria del juego en España copando el 35 % del mercado si a esto le sumas que de los beneficios de
es,T1kQjGv5j2c,20,los pelos contra celtics la barba anotó 42 puntos con el triple decisivo sabiendo que su joven fan estaba ahí
es,k___aPAxbck,34,si eres un usuario básico Pues aquí tienes las 3 claves de estas Sony zv1 mark2 nos vamos a dejar algún enlace en
es,CsMXJ7JZmPs,206,que está niveles de previos a cuando explotó la burbuja del año 2007 -2008 de financiera de acuerdo y ahora mismo
es,RFAp41OhUX0,134, 1 .200 euros un trabajador que ingrese 50 .000 euros manuales actualmente en la comunidad de Madrid estará pagando un
es,RFAp41OhUX0,92,del 15 % para ingresos de hasta 70 .000 euros y un segundo tramo del 25 % para ingresos superiores a 70 .000 euros y a
es,5CtQfZQPfMc,75,nos ha anunciado son una versión 10 el que tiene 197 caballos la 520d y una 520i de gasolina que tiene 208 caballos
es,yZeZpiW2gKw,148,el nombre de wish Technology sociedad limitada en 2006 y como su director figuraba de Jamie a How y no fue hasta
es,wOZh0Bf4kW4,12,alucinante es la Marina de Estados Unidos en 2019 Pero ha salido ahora Cómo Atrapan un narco submarino no es el
es,UrIAA-ebM38,190,Release candytected en mi mismo iPhone 14 Pro me dio las siguientes puntuaciones en Single Core 1878 y en
es,HREPJnV-iP4,127,le contamos en el programa en el que se pasaron un pueblo que se pasó 70 -80 a partir de ahí la clave es la munición
es,2ZcCNKK6s8M,712,madrugada que era top seguramente en Hispano el top 1 y ahora hemos bajado no es que ahora voy
es,z021WI0ukqw,139,calor dazarito 37 dice va perra no hasta 2028 no lo creo lazarito Dale iñaki dice
es,8jaM73DhISg,78,Fiscales se desploman un 9 con 2400 de 461 mil millones de dólares pasan a 418 .000 pero es que se ha disparado el
es,0APdFa2me_w,104,una oferta quería negociar el precio y decir Bueno si tiene un 35 % menos de vida útil después Cuéntame un 30 % al
es,ndgyfAM0Fv8,231,Cuál es la diferencia entre el hay micro Y el sc6 te la cuento Al final del vídeo [Música]
es,l4UUC52KLFA,153,similar a la fuerza que tenía cuando inició la invasión en febrero de 2022 y que está consta de unos 200 .000 hombres
es,joNBIdvgKYQ,94, 5 .000 dólares la botella esta de champán bueno valdrá 5 .000 $ en la discoteca Pero bueno tenemos la moto Kawasaki y
es,ZhxtyNKpIig,130,niveles vale estar en Madrid es lo máximo juega 20 partido por juego 20 juego 25 25 pero y ni una palabra y
es,Lxw3MvBC1hw,90,centrados como el del xiaomi 13 Ultra o por ejemplo el Magic 5 pro de honor que también tendría como este tipo de
es,SZb3D69C4PE,41,"el obstrucciones con todas las instrucciones todas 
las herramientas necesarias para su montaje viene   evidentemente con el cable del cargador también 
el cargador que podemos cargarlo en unas 5 horas   más o menos pero este detalle es el certificado de 
la comunidad europea para hacerlo legal Así que En  "
es,erF0G2HcxYM,100,espanya y bueno las termitas del vídeo del 20 de navidad y eso que se bueno eso no era entrenar eso era venir a hacer lo
es,yzpVVaXs9sc,55,funcionado muy bien ha llegado a alcanzar los 146 kilómetros por hora en algunos momentos del partido Este es el
es,5mFBsRcz5sw,87,este p 60 pro con 88w de Carga rápida con 66 vatios este honor carga en una hora y 10 minutos como veis no hay mucha
es,2BXehT5-p-Y,4,dinero estamos hablando a lo mejor de 40 o 50 euros como mucho aparte de ver reviews para ver lo que hay por ahí en
es,X91FnpeyMqg,22,Sorpresas del próximo pool Run llevando su precio a 100 nuevos máximos Y posicionándose nuevamente entre las
es,XMVwk9qElUI,174,tommaker harían un Dúo letal en la cancha en 2015 fue seleccionado como el prospecto número 10 por el two for seven
es,B3Sjnfuvwv0,164,fortuna y para haceros una idea decía que en esa época estaba ganando 25 millones de dólares al día 25 millones
es,VTA4rtqvnBM,221,el test en el iPhone 11 Y estos fueron los datos en la Beta 4 la puntuación Single Core fue de 1722 y la multi-core
es,QmOGdGuarX4,135,deshinchado ligeramente volviendo a testear el nivel de los 25 mil dólares que coincide aproximadamente con los
es,c9MYXZfTAQM,143,de estos Y esto es como pues esos 14 euros y los de 5000 son como 35 euros o algo así bueno y el de 5000 por detrás
es,hpY5TVwsjDY,119,punto de entrada decía y él recordaba en marzo del 2020 lo peor del confinamiento fue a la televisión y dijo que también
es,WatTqrq8kQQ,170,veremos porque 1 de los apartados del curso Precisamente es ver eso 1991 es un lenguaje que no ha dejado de evolucionar
es,4SCndg3N17Y,114,que llegaron a gobernar por más de 2 siglos a partir del 16 los gobernantes safávidas aprovechar lo mejor del legado
es,5zh-JBSeHmE,127,estamos hablando de versiones con hasta 100 .000 euros de coste como es el caso de la samid limited que estamos probando
es,XyiQUBNl8zE,151,avanzado un poquito avanza un poquito 222 Acércate aquí Acércate aquí por favor
es,UKBfxtfGZLE,236,Pues eso que coja la máxima velocidad puedo ir hasta 120 porque la autovía es bueno lo que me permite en el caso que
es,fCoDOZF2bdk,88,quiero quedar que yo voy a agotar este año de contrato que tengo hasta 2024 luego ya por lo bajín y dice otras cosas
es,bqifX6TVR5U,163,auténtica borrada con la posibilidad por supuesto de montar el m2 Ultra con capacidades de tarjetas de expansión pci
es,F6cXloymOUE,110,probabilidades de éxito de este nuevo grupo económico para contrarrestar al g7 son muy elevadas dado que agrupa al 43 %
es,sBKhfKTqzBM,179,sé cuándo ha marcado Ya pues no lo sé como 1 .5 2 goles por partido por entrenamiento y la verdad es que cada
es,T1lDKbIQcLg,170,titulados GameStop Yolo había invertido 53 mil dólares en acciones y opciones de compra de GameStop y no no es que fuera
es,ydTumL8g_rY,1,vivir con el mítico Toyota Supra un coche de hace 30 años que usado sigue costando más que la mayoría de coches
es,v0Elh3O0co8,310,gratis Sí qué talla usa señorita 39 pase por favor un 39 por favor confirmado el negro te gusta Entonces pues venga para
es,NMAUmZTBMME,133,manguel no se quedó muy lejos con casi un 20 y mucho mejor que el dow Jones quizá apenas un 5 % durante esos Pues 1 5 
es,Kk8clYOSi38,247,Exactamente igual que la trasera 26 por 1 con 95 pero vemos que aquí arriba hay un amortiguador de horquilla Por eso
es,FtWcuysFQng,121,y me estoy refiriendo básicamente a 3 elementos la normativa Euro 7 Cómo impacta esto a la llegada de los
es,z021WI0ukqw,163,Muy buenas tardes almo muy buenas a todos bueno que no sé mira Óscar 75 19 Saludos desde Austin Texas dice el bueno
es,-UJpzbq6VXE,154,autodenominada por la Unión Europea agenda 2030 por parte de los políticos es el tema de que Francia va a
es,pKzKMlgKP-0,30,como en el tamaño es cierto que estamos hablando de un móvil de unos 370 euros lo que son unos 400 dólares unos 6000 y
es,-UJpzbq6VXE,201,esta Norma va a entrar en vigor en el año 24 en ese país en Francia se dan para la compra de los automóviles
es,PxQqVG-7eM4,27,que he estado usándola en mi equipo principal en mi iPhone 14 promax y no tengo buenas noticias Pero bueno os lo
es,gql7ZkHHej4,199,compra con la que ya acumulan 138 .955 bitcoin a un precio medio de 29 .817 dólares por bitcoin y que pocos
es,fbk53e23DqU,125,pared ya este fue un tratado alcanzado en el año 1278 entre El conde de foa Roger Berna III y el obispo de urgel
es,tOteXrG6gus,51,muchísimas canciones pero es que además Tiene 90 .000 efectos de sonidos con nuevo contenido añadido de forma semanal
es,c9MYXZfTAQM,158,monedas que esta es de 100 yenes hay también monedas de 500 pero yo no tengo ninguna 50 yenes por detrás creo que
es,0jQmDLCFkLg,7,cobran por una actuación luz casal 120 .000 euros Antonio Orozco 157 o 163 pero vamos a los interesantes
es,dcKiTvwU1yo,87,Fútbol Club Barcelona un club arruinado con más de 4 .000 millones de deuda al que una vez más le aprueban sin haber
es,rYZ7zlyjLSA,64,por ejemplo poniendo un Ok si alguien te dice que vamos a las 7 de la tarde Sí ya está fácil sencillo puedes escribir lo
es,YWQf6Oo6HpE,111,más característico de esta nueva campaña económica es un pin con 17 secciones en diferentes colores que representa a cada
es,joNBIdvgKYQ,219,pegadísimo el suelo tío qué locura Y son 3 millones de dólares que acabamos de conseguir por el Fórmula 1 de Ferrari
es,XFNbBUKZ6Rc,30,carrera con 1087 en solo 70 partidos prometiendo 206 puntos por encuentro por supuesto Hola América
es,iHuJU64crBg,93,Rayo la tienen servicio de atención al cliente 24 horas tienen un soporte experto en wordpress para ayudar en lo
es,ClS2pwggzaY,34,de los del realme 11 Pro Plus Se confirmó el precio de 7999 euros un precio muy interesante os dejaré algún
es,B3Sjnfuvwv0,122,vemos que ya tenía 6 ideas de altruismo El r2 ganar para dar y de hacer del mundo un lugar mejor y como
es,GTHoZyp9Kuw,52,deslimitar súper fácil así que atentos porque este pequeño alcanza 35 kilómetros por hora una velocidad que
es,T3ugOYTRF7c,99,cierto que se presenta o se habla de que se está desarrollando en 2011 pero digamos que no sale una versión final
es,qbdcsmaM2fo,138,bitcoin un retorno bastante jugoso Por cierto hasta del 40 % al mes Vamos que el bono de satisfy reúna plataforma que no
es,RFAp41OhUX0,159,con la reforma de vox pagaría un irpf de 12 .500 euros por tanto comprobamos que se trata de una rebaja del impuesto
es,qKRM4TnoDVw,136,la Fed hizo la subida que se esperaba 025 y Lo importante fue durante el discurso de genom Powell y ha dicho que
es,M4q7AEGF0yA,128,este podría existir Eh puede costar 120 .000 y la Silla un millón
es,yaxPPoRdwmM,24,muchas acciones vamos a ver cuál es su visión para este año 2023 le han preguntado acerca de la crisis y ha dado
es,_gHMJDrFwqg,148,pesan prácticamente lo mismo un poquito más el f5 pero vamos apenas se nota la diferencias y un detalle que también me
es,q6fm8cWfd50,80,de Madrid lo meterían entre los 25 o 30 40 mejores jugadores del mundo hablarían alguna vez del Gran Vinicio Junior es
es,uQlHt8XKaeE,65,para apuntaros al último curso de este año 2022 y mañana a medianoche se cerrarán definitivamente las las
es,at0fEM4DTKY,122,precio bárbaro para este dispositivo que no llega ni a 400 euros por lo que vamos con el siguiente producto hablemos de la
es,UKBfxtfGZLE,197,hemos consumido las 2 primeras por lo tanto vamos al 80 % de la batería la velocidad a la que he venido pues
es,wgDhhdppO6Y,33,sobre las 3 tenemos 2 horitas para grabar que a las 5 :20 nos pidamos bajo el girola
es,UfWFTJ7OQJI,15,cerradas que si das un puñetazo a varios c4 se explotan pero que si luego pasas un tanque por encima no normalmente yo
es,axGlwsPHSug,169,un Peugeot 504 clásico a ver desde el año 1970 esto es un clásico eh tío esto a ver amiga le puedo Añadir fotos pero
es,KANcLpyMMlo,42,sale la versión de 12 y 512 de almacenamiento sin embargo el s23 plus sale 8 y 256 para la versión de 512 te
es,80faMKjIc0w,156,de la vida útil del vehículo o no recordad que a partir de la Euro 7 las autoridades quieren que los coches
es,pKzKMlgKP-0,22,rompen todas las pautas estamos hablando de una batería de 22 .000 miliamperios es que es una auténtica barbaridad Y como
es,TrymkIqb_lw,151,relevante del el sector bancario desde la crisis del 2008 Y más si hablamos a nivel europeo donde todo esto del
es,DcjUXXArBC8,24,mbappé llega al Real Madrid buff 95 % qué tal a todas y a todos Cómo estáis
es,HREPJnV-iP4,27,menor haber conseguido eso por parte del S p500 Y a partir de ahora hay que empezar a entender si esto es punto de
es,sdDZUl9BlPg,105,gustará realmente Cómo se juega con un 442 creo que el madridismo está muy acostumbrado al 433 un equipo más
es,wSUMgFReiJQ,72,Norte en su año Junior nombrado Hola American en el 85 y 86 recuerdos con su número retirado en Georgia entrando en
es,wSUMgFReiJQ,217,estos 4 jugadores acabaron por encima de los 15 puntos por partido y price logró ser el mejor en su posición
es,HhKH_M3gg14,12,decir lo que es esto porque esto estamos hablando de un producto cuesta unos 6 euros 7 dólares o 112 pesos y es que a
es,nbCDY1zG7ME,89,llame o nos llame mbappé y nos digan el precio que será unos 200220 230 o lo que sea vale Así que bueno pues en ese
es,bM4NBh-N05A,135,puede dar Precisamente es el más pequeño es el Corsa No eso nos da con esos 51 kilovatios Hora pues una autonomía
es,fqNs8Ovrr6g,26,que está a punto de abandonar el Real Madrid por 10 millones de euros lo hemos dejado os lo hemos dejado en Tribuna
es,odEJ2LiTSII,42,en algún momento ni sobre todo cuando va a llegar pues bueno la cifra de 500 .000 creo que también lo merece y como digo
es,hjDsjhHr5XU,16,el segundo una autonomía increíble 5000 miliamperios y 10 vatios de Carga rápida nos permite hacer todo lo que queramos Y
es,IY8ZhOUE2TU,70,eurozona la eurozona está creciendo alrededor del 05 % mientras que España en los últimos trimestres está creciendo
es,ClS2pwggzaY,25,viendo las especificaciones y en el evento de presentación del realme 11 pro y del realme 11 Pro Plus donde también
es,UMeGExMLSxw,44,que funciona bastante bien y está limitado a 25 kilómetros por hora podría alcanzar 30 Sí pero tal como sale de
es,zZf5WtPRSWU,98,parece que es inminente el hecho de que nos acerquemos una recesión en 2023 la magnitud de esta recesión dice es
es,MRKpVxn5fqI,43,hace más de 13 años el concepto de expresión regular surge en el año 51 comenzando a popularizarse en los años
es,dth7AKh8lsg,200,más de un 24 %. mientras que tendríamos como han aumentado desesperadamente sus reservas
es,G4CIbqSk3j8,15,de Xbox Live por hacer diversas trampas en este último juego fue en 2007 panchi recibiendo además varias alertas de
es,9wIxr8Q6sVg,175,las 2 rosas en esta guerra que comenzó en el año 1455 los usuarios de la casa Lancaster se enfrentaron contra Los
es,yzpVVaXs9sc,-1,nos está mal acostumbrando Carlos Alcaraz 20 años No para de regalarnos nociones Nico después del abierto de
es,K5l3PecRikU,306,esto de aquí no me lo tomo por nada del mundo 50 euros ahora mismo 50 euros entero ni de coña ni de 70 estás muy
es,5712roAYDII,18,complemento perfecto para audores en 2006 siendo el poseedor de un anillo y no solo eso chocolate blanco formaría
es,SQYPVpoRBVU,110,están hoy por 160 euros cuando su precio de salida es de 240 euros 1 muy buenos auriculares en diseño con cancelación de
es,7qkQfHixSvM,95,para llegar al máximo escenario en la temporada 20222023 jaques prometió 175813 asistencias llevándose los
es,UjR1_925ekg,20,la primera Beta para desarrolladores de iOS 16 .6 también de paso es 16 .6 de guacho es 9 .6 de Mako West 13 .15 y de
es,NRCYqTIIdmY,166,pero nadie dijo que iba a ser fácil Porter Junior 3 operaciones de espalda en 5 años
es,hjDsjhHr5XU,13,viene directamente del mundo de la moda el segundo una autonomía increíble 5000 miliamperios y 10 vatios de Carga rápida
es,JQZEtMQa7F0,11,zona de El Pinar En punta gorda las llamas han empezado en el kilómetro 76 de la lp1 El Poli a que te sitúa Y esa
es,B3QiyQcM3BM,64,como se retiran y cómo se cargan la cuestión es que son de 60 voltios 45 amperios y eso nos da una autonomía
es,Zw5QL3-Zyio,47,lo tenemos es de 500 vatios con picos de 1000 vatios y digamos que tiene como novedad o lo que a mí me fascina son sus
es,d43kF_6YYmM,150,para atrás unos cuantos meses concretamente hasta el año 2022 cuando blackrock empezó a fijarse en el mercado
es,X2H_T1wnMYU,109,próximos 12 meses en el 34 % rebota con lo que se esperaba el mes pasado se esperaba el mes pasado
es,MRUPyHRU664,115,es que Apple lanzó esta semana guacho es 9 . 5 .1 una actualización menor soluciona algunos errores para el Apple watch en
es,uqyalW3uR-A,104,bolsa y para que os sirva de inspiración y luego ya el otro 80 % del libro pues es quiero que lo veáis como un manual o
es,3uvuFOPp8ws,38,portavoces parlamentarios de Cara a las elecciones generales del próximo 23 de Julio en España y pachi López portavoz
es,CsMXJ7JZmPs,95,una de las 3 siguientes reuniones hasta alcanzar de momento el 4 % Y esto no lo había puesto en precio todavía el
es,kL-ypltfRAo,90,2014 fue el gran año de los walcards Julius acabaría la temporada con 24 doble dobles ayudando al equipo a llegar
es,kpsVJptSv1U,128,decisión bienvenidos y bienvenidas al día 3 de un día un lenguaje es el turno de Swift
es,SZb3D69C4PE,125,"un pequeño tutorial y ya estaría enlazado vamos 
a ver cuánto corre en cada modo tiene 3 modos   así que como es típico el modo más bajo el más 
lentito son unos 6 por hora que suele ser como una   velocidad biondante en el modo 2 son 20 kilómetros 
por hora y en el modo 3 son 25 kilómetros por  "
es,STKmdiqkBTk,44,el Atlético de Madrid se ha levantado y a las 6 de la mañana para hacer una sesión de entrenamiento a las 7 :30 de la
es,UjR1_925ekg,90,iOS 16 .6 la que Posiblemente sea la última versión de iOS 16 antes de la presentación de iOS 17 el 5 de junio
es,utUv8raK5FY,2,nunca te ha enviado una solicitud y amigo jóvenes solteras a 3 km mariana quiere sexo
es,3OAQffhQxxE,145,dólares nos estaremos embolsando una rentabilidad de 1000 dólares anualmente y es que el interés simple tiene la
es,hCMeGjDhClM,46,sobre él no podíamos acceder a esta función en la Beta 2 se eliminó este menú y habrá vuelto a aparecer en La
es,rPy3BNF5ozE,33,calidades y podríamos hablar de un montón de opciones Como por ejemplo 120 hercios en refresco es el único
es,GEPeqwQLKIk,201,versión 1 .8 por 152 caballos para la versión 2 .0 en teoría es mucha diferencia pero es que luego la
es,ehVPKgnxneM,6,a priori podría parecer que sencilla es un teclado lo cual en 2023 no es algo que sorprenda pero tiene Inteligencia
es,yUP_pNOwOJg,23,junta de extremadura y futura presidenta de extremadura hace apenas 10 días rompiendo relaciones institucionales con
es,8h_Au5x8GNs,184,fenómeno Madrid se encuentra algo por debajo de la media con el 12 % algo que apuntan los expertos partimos de unos
es,qentqR-x-0w,336,sobre mbappé París 5 de Julio 2 de la tarde es la fecha y hora en la que el psg ha
es,q1j7KygaRBo,107,al orden de laza y coincidió que era el número 8 increíble y sin planificarlo ni nada justo el tomo del dinero tenía que
es,3fRCF7eYtag,190,pequeño porque a ver llegas a una edad a los 20 o 25 que te dejan de interesar los videojuegos ya no te aportan mucho
es,w07AoCLx6j4,112,el mecánico el mecánico lleva 12 militares a un ritmo porque pierden viajes
es,ArBnj7rKjX8,49,un desperdicio porque la gente los quita mitad y no van a ver el día 3 que está mucho más guapo que es el siguiente
es,u11nP_ahCyo,157,permite todos los datos del Toyota chr 2024 que se va a empezar a vender y a entregar a finales del año 23 entre el
es,VTA4rtqvnBM,230, 3 .822 Pues bien en la quinta Beta la puntuación ha sido de 1654 puntos en Single Core es decir 68 puntos menos y
es,VTA4rtqvnBM,66,con el peso de la actualización como siempre hago en mi caso con el iPhone 14 Pro Max la actualización pesaba 539 
es,r5Y4jPZnspM,148,rendimiento vale Sí que es cierto que al final Pues pensábamos el snapdragon 8 generación 2 es muy potente en este caso
es,2e0cOMiqjFk,267,mil veces mejor que tu smartphone o tu tablet 100 veces mejor que tu portátil y 30 veces mejor que tu televisor y ahora
es,_COZAsJL_UU,105,un dato bastante malo en primer lugar la inflación fue de 8 .2 se esperaba 8 .1 pero lo más problemático es que me sobre
es,TsTEhd4SH2U,64,vídeo de nuestra nueva casa esto que tenéis atrás sólo es un 0001 de toda la casa a la que nos hemos
es,8fdcosQhHNM,39,cartera de cliente de aproximadamente 20 empresas hice una maestría en gerencia de las finanzas y los negocios
es,dVUGU-lxKkc,151,noticias que junto a todos los acontecimientos que vivimos en el 2022 han afectado a su precio y no
es,Cj52In8cL3I,72,ese concierto fue interesante porque sacamos fue en DF habían más de 3 .000 personas fuera y nosotros salimos que
es,ZM_e0wA9Sy0,92,pulgadas de pantalla pero es cómodo en la mano yo pasaba del s23 más compacto y tenía un poco de miedo a ese salto no de
es,P4MNAPTTpK0,5,todo 2023 tras sufrir Una caída de casi un 7 % y retrocediendo desde los 30 .000 hasta los 27 mil dólares que se
es,KczhWiCUeIM,209,[Música] disputando 24 partidos como titular llegando a promediar 73 puntos y 63 
es,X91FnpeyMqg,180,ordinas de bitcoin o con los tokens vrc-20 que en cuanto el volumen ha crecido muchas transacciones se han
es,VTA4rtqvnBM,10,iOS y hay pazo es 16 .6 también la de maco West 13 .15 guacho es 9 .6 y tibio es 16 .6 así que en este vídeo lógicamente
es,x3sa9Sce8do,98,pujar por pujas se están subastando 30 pujas por 2 céntimos por increíble que parezca esta oferta
es,3uvuFOPp8ws,178,primer trimestre del año 2019 había en España 19 millones 471 .000 trabajadores y en el primer trimestre del año 2023 
es,Ln6uC-CEHVM,231,luchar con el con el modo oportunos no a lo a lo Final Fantasy 7 a los Final Fantasy 8 al 9 al 10 yo era muy de
es,4oGvbdlLaCo,230,que te pasas por aquí pues bueno soy Javier Cabrera y desde el año 2013 me dedico a ayudar a personas que quieren
es,aculELRg_0M,8,puede o piensa que puede haber una recesión con un 100 % de probabilidad vamos a ver un poco lo que ha declarado
es,bpxPcdsH8gM,266,como para el vídeo pero la sombra parece como que qué Guay bueno 39 km por tanto llevamos 20 solo ha bajado una raya en
es,kAhIO1nx6FU,170,descripción y elegimos nuestro dispositivo en mi caso es el iPhone 14 Pro lo siguiente es Descargar la última
es,xuOcMXp6N5g,156,de pago por uso se podría realizar en el año 2024 de acuerdo con la experiencia internacional de 2 a 3 años es el
es,VrVxpZj8Rac,47,de prima de fichaje y unos ingresos de publicidad que alcanzan los hasta 90 kilos la ecuación final queda en un
es,ClS2pwggzaY,141,realmy muchos de sus modelos sea el que sea es la Carga rápida y aquí en 10 minutos de carga vamos a tener 7 horas
es,QO_IRatKfRo,205,jugar desconectado de un enchufe Pues dicen que hasta 8 horas pero si vas a jugar a juegos como el GTA 5 o como en
es,4FwPo_odpRk,63,manera que el euro no puede volar como está volando hasta 1 12 con superávit comerciales menores incluso déficit en
es,tGJXzk1E3g0,140,creo que no tiene sentido a día de hoy en 2023 que se cargue en los tiempos que carga que duplica o triplica incluso
es,wOZh0Bf4kW4,26, 17 .000 pounds que deben ser como libras de cocaína es decir unos 230 millones de dólares en cocaína no más o menos un fin
es,TsTEhd4SH2U,205,tenemos y luego está la m l y xl ok si queréis haceros una idea yo vi de 173 y pones aquí llevo muy anchas y llevo la
es,NV4ZBkCfblQ,10,mundo Te voy a dar un dato escalofriante esta compañía controla más de 10 trillones de dólares y se ha convertido
es,KANcLpyMMlo,44,almacenamiento sin embargo el s23 plus sale 8 y 256 para la versión de 512 te vas a más de 1 .300 euros entonces aquí
es,6cnFl9aHD5Y,33,Soy ingeniero de software desde hace más de 13 años javascript es un lenguaje muy potente y versátil podemos crear
es,BLyRe3swurU,16,el segundo una muy buena pantalla tenemos amoled 165 hercios buen brillo todo lo que podemos necesitar Y por
es,kL-ypltfRAo,85,una única Campaña en la que promediaría 15 puntos y 104 rebotes por partido 2014 fue el gran año de los walcards
es,0KS1BW6Xhlk,71,de fundaclear la que es totalmente transparente y que tengo en mi iPhone 14 promax prácticamente desde el día que lo
es,K-XcujHGtBI,130,invertir igual que inversa y ha multiplicado por 20 veces en 20 años superando el rendimiento que ha dado la
es,8JfBeeFUMGU,63,pasado mes y ahora quieren que sobre esos 10 puntos se establezca un nuevo tratado de paz desde el alto el fuego y
es,rzMFAJ2Y_dk,206,pudieron reorganizar y aumentar su número de efectivos hasta proclamar el 7 de noviembre de 1931 la República
es,pKzKMlgKP-0,75,es una auténtica pasada de 3 vatios de potencia que alcanza 130 lúmenes y que se puede utilizar directamente como luz
es,ZuGo0pQb0aU,4,azote de los vende humos y resulta que me han estado tomando 30 euros al mes desde noviembre de 2000 21 y ni me había
es,joNBIdvgKYQ,205,Cómo se pega el suelo el Fórmula 1 chaval Mira cómo dobla eh Y vamos a 180 eh lo Qué locura de coche Qué locura de
es,RFAp41OhUX0,177,reducir en 4 puntos cada 1 de los tipos impositivos del irpf El 15 o el 25 % 4 puntos por cada hijo que tenga
es,T1lDKbIQcLg,174,compra de GameStop y no no es que fuera un millonario que le sobras en 53 mil dólares Yolo significa You only live
es,aqGwTVrKqI0,43,continuación por supuesto recomiendo a todos que veáis el vídeo de iOS 17 que subimos a principios de semana para
es,u11nP_ahCyo,99,coches más vendidos en el mundo y en este ranking en el top 10 por poco no está dentro también nada menos que el
es,RWLDcsUhJtQ,18,de llegavid dios Este es el patinete en Google S6 que está muy bien pero tiene un ligerito problema que es que no
